type,img,question,A,B,C,D,difficulte,theme,fuzzy,exact,,,,,
S,67,Quel est le nom de ce jeu vidéo ?,Minecraft,Roblox,Terraria,Fortnite,1,Jeux & BD,-,,,,,,
S,68,Quel est le nom de cette actrice ?,Jodie Foster,Julianne Moore,Sigourney Weaver,Helen Hunt,2,Cinéma & Séries,foster | alicia christian foster,,,,,,
S,69,Quel est le nom de cet acteur ?,Ron Perlman,David Harbour,Clancy Brown,Vincent D’Onofrio,3,Cinéma & Séries,perlman | francis ronald perlman,,,,,,
S,70,Quel est le nom de cet acteur ?,Danny Trejo,Robert Rodriguez,Edward James Olmos,Cheech Marin,3,Cinéma & Séries,trejo | daniel trejo,,,,,,
S,71,Quel est le nom de cet acteur ?,Alexandre Astier,Alain Chabat,Kad Merad,Franck Pitiot,2,Cinéma & Séries,astier,,,,,,
S,72,Quel est le nom de cet acteur ?,Alain Chabat,Dominique Farrugia,Édouard Baer,Didier Bourdon,2,Cinéma & Séries,chabat,,,,,,
S,73,Quel est le nom de cet acteur ?,Edward Norton,Mark Ruffalo,Guy Pearce,Adrien Brody,2,Cinéma & Séries,norton,,,,,,
S,74,Quel est le nom de cet acteur ?,Cillian Murphy,Tom Hardy,James McAvoy,Daniel Day-Lewis,2,Cinéma & Séries,murphy,,,,,,
S,75,Quel est le nom de cette actrice ?,Gal Gadot,Anne Hathaway,Natalie Portman,Brie Larson,2,Cinéma & Séries,gadot,,,,,,
S,76,Quel est le nom de cet acteur ?,George Clooney,Val Kilmer,Richard Gere,Hugh Grant,1,Cinéma & Séries,clooney,,,,,,
S,,"Dans quelle ville américaine se situe le musée ""World of Coca-Cola"" ?",Atlanta,New York,Boston,Dallas,3,Économie & Politique,-,,,,,,
S,,Quel est le nom de code du premier essai nucléaire français ?,Gerboise bleue,Gerboise blanche,Gerboise rouge,Gerboise verte,3,Histoire,-,,,,,,
S,,Dans quel club de football Zinédine Zidane a-t-il terminé sa carrière de joueur ?,Real Madrid,Al-Sadd SC,AS Cannes,Juventus Turin,2,Sport,real madrid club futbol | real madrid cf,,,,,,
S,,Quel psychologue a proposé la hiérarchie des besoins représentée sous forme de pyramide ?,Abraham Maslow,Sigmund Freud,Ivan Pavlov,Wilhelm Wundt,2,Divers,maslow,,,,,,
S,,"En chimie, que signifie le sigle ""pH"" utilisé pour mesurer l’acidité d’une solution ?",Potentiel hydrogène,Potentiel hydraulique,Potentiel hydroélectrique,Potentiel hydrochimique,3,Sciences exactes,-,,,,,,
S,,Quelle est la valeur du pH d’une solution neutre ?,7,1,3,12,2,Sciences exactes,sept,1,,,,,
S,,Quelle est la console de jeux vidéo la plus vendue de tous les temps ?,PlayStation 2,Nintendo Wii,Xbox 360,Nintendo Switch,2,Jeux & BD,ps2,,,,,,
S,,Quelle est la couleur de l'améthyste ?,Violet,Orange,Bleu,Vert,2,Divers,violette,,,,,,
S,,"Que manque-t-il à la statue de la ""Vénus de Milo"" ?",Les bras,La tête,Les seins,Le nez,2,Arts & Culture,ses bras,,,,,,
S,,Quel est le signe astrologique d'une personne née un 5 avril ?,Bélier,Taureau,Poisson,Balance,2,Croyances,-,,,,,,
S,,Quel groupe sanguin est le moins répandu dans la population mondiale ?,AB,O,A,B,2,Sciences de la vie,AB-,1,,,,,
S,,Quel est le groupe sanguin d’une personne considérée comme donneur universel ?,O-,B+,AB-,A+,2,Sciences de la vie,O négatif,1,,,,,
S,,Quel nom donne-t-on aux noces célébrées pour 60 ans de mariage ?,Les noces de diamant,Les noces d'or,Les noces de platine,Les noces de chêne,3,Divers,diamant,,,,,,
S,,Quel homme politique a occupé le poste de Chancelier fédéral allemand de 1998 à 2005 ?,Gerhard Schröder,Helmut Kohl,Olaf Scholz,Angela Merkel,3,Économie & Politique,schroder,,,,,,
S,,"Dans un tournoi de football à élimination directe, combien d'équipes s’affrontent en 16èmes de finale ?",32,16,8,4,1,Sport,trente deux | 32 equipes,1,,,,,
S,,Dans quelle ville française se situe la place Stanislas ?,Nancy,Metz,Dijon,Valenciennes,3,Géographie,-,,,,,,
S,,Quelle est la carte d’atout ayant la valeur la plus élevée à la Belote ?,Valet,Roi,9,As,2,Jeux & BD,valet d'atout,,,,,,
S,,"Dans un jeu de cartes français, quelle carte est surnommée ""Pallas"" ?",La Dame de pique,Le Valet de trèfle,Le Roi de coeur,L'As de carreau,4,Jeux & BD,-,,,,,,
S,,"Quel souverain franc est surnommé ""l'Empereur à la barbe fleurie"" ?",Charlemagne,Clovis,Louis le Pieux,Charles Martel,2,Histoire,carolus magnus | charles i,,,,,,
S,,Quel footballeur a remporté le titre de meilleur buteur du Mondial 1986 au Mexique ?,Gary Lineker,Diego Maradona,Careca,Emilio Butragueño,4,Sport,lineker,,,,,,
S,,Quel est le subjonctif imparfait à la première personne du singulier du verbe boire ?,Que je busse,Que j'eusse bu,Que j'aie bu,Que je boive,3,Littérature,-,,,,,,
S,,À quel peuple doit-on l’invention de la boussole magnétique ?,Les Chinois,Les Égyptiens,Les Grecs,Les Incas,2,Technologie,-,,,,,,
S,,Quel fruit obtient-on en récoltant un plaqueminier ?,Le kaki,Le fruit du dragon,Le jujube,La mûre,3,Sciences de la vie,plaquemine japon | plaquemine chine | figue caque,,,,,,
S,,Quel État européen a intégré la zone euro le 1er janvier 2023 ?,La Croatie,La Pologne,Malte,La Hongrie,3,Économie & Politique,-,,,,,,
S,,"Dans quelle région française est né le mouvement des ""Bonnets rouges"" en 2013 ?",La Bretagne,La Corse,L'Île-de-France,La Guyane,2,Actualités & Médias,-,,,,,,
S,,"En médecine, quel terme désigne la perte complète du sens olfactif ?",L'anosmie,La nasotomie,L'ablairose,La phantosmie,3,Sciences de la vie,-,,,,,,
S,,"En médecine, quel terme désigne la perte complète du sens du goût ?",L’agueusie,La xérostomie,L’aphasie,La cacosmie,3,Sciences de la vie,-,,,,,,
S,,Quel est le terme médical pour décrire une hallucination olfactive ?,La phantosmie,L’hyposmie,La cacosmie,L’anosmie,4,Sciences de la vie,-,,,,,,
S,,Dans quelle partie du corps humain trouve-t-on l’uvée ?,L'oeil,L'estomac,Le pharynx,L'oreille interne,2,Sciences de la vie,yeux,,,,,,
S,,"Comment s'appelle le personnage principal du roman ""Le Parfum"" (1985) ?",Jean-Baptiste Grenouille,Jean-Marc Lézard,Jean-Marie Raton,Jean-Pierre Castor,3,Littérature,grenouille,,,,,,
S,,Quel pigment donne leur couleur verte aux plantes ?,La chlorophylle,La carotène,La lignine,La xanthophylle,2,Sciences de la vie,-,,,,,,
S,,Dans quel pays se situe la Kaaba ?,L'Arabie saoudite,La Turquie,Le Pakistan,L'Égypte,2,Croyances,-,,,,,,
S,,Quel élément de l'oeil s'opacifie lors d'une cataracte ?,Le cristallin,La cornée,La rétine,L'iris,2,Sciences de la vie,-,,,,,,
S,,Dans quel pays se situe la ville de Dubaï ?,Les Émirats arabes unis,L'Arabie saoudite,Le Qatar,Le Bahreïn,2,Géographie,eau,,,,,,
S,,"Quel pays est surnommé le ""pays du Soleil levant"" ?",Le Japon,La Chine,Le Vietnam,La Corée du Sud,1,Géographie,-,,,,,,
S,,"Dans quel océan se situe le ""triangle des Bermudes"" ?",L'océan Atlantique,L'océan Pacifique,L'océan Indien,L'océan Arctique,1,Géographie,atlantique,,,,,,
S,,Quel alcool est utilisé dans la réalisation d'un mojito ?,Le rhum,La vodka,Le gin,La tequila,2,Gastronomie,-,,,,,,
S,,En quelle année la mission Apollo 11 a-t-elle permis le premier pas de l’homme sur la Lune ?,1969,1959,1963,1974,2,Histoire,-,1,,,,,
S,,De quel végétal se nourrit principalement le koala ?,L'eucalyptus,Le bambou,L'aloe vera,Le mimosa,3,Sciences de la vie,-,,,,,,
S,,Que vaut ce chiffre romain : XXXV ?,35,20,8,97,2,Histoire,trente cinq,1,,,,,
S,,Qui a fondé la communauté Emmaüs pour venir en aide aux plus démunis ?,L'abbé Pierre,Mère Teresa,Coluche,Jean Vanier,2,Divers,henry groues | groues,,,,,,
S,,"Quel phénomène esthétique provoque l’aspect bosselé de la peau appelé ""peau d’orange"" ?",La cellulite,Le vitiligo,Les vergetures,Le psoriasis,2,Sciences de la vie,-,,,,,,
S,,Quel glucide complexe est stocké par les plantes et retrouvé en grande quantité dans les féculents ?,L'amidon,Le saccharose,Le glycogène,L'insuline,2,Sciences exactes,-,,,,,,
S,,"Quel est le nom donné au cuir de chèvre, raffiné et coloré, employé en reliure fine ?",Le maroquin,La basane,Le nubuck,Le chagrin,4,Arts & Culture,cuir marocain,,,,,,
S,,"En chant lyrique, quel type de voix masculine se trouve entre la basse et le ténor ?",Le baryton,Le soprano,Le contralto,Le contre-ténor,2,Musique,-,,,,,,
S,,Dans quel pays a eu lieu la révolution spartakiste en janvier 1919 ?,L'Allemagne,La Russie,L'Italie,L'Espagne,3,Histoire,-,,,,,,
S,,"Quelle danseuse du Moulin Rouge portait le surnom de ""La Goulue"" ?",Louise Weber,Jane Avril,Josephine Baker,Isadora Duncan,4,Histoire,weber,,,,,,
S,,"Quel footballeur autrichien des années 1930 était surnommé le ""Mozart du football"" ?",Matthias Sindelar,Josef Bican,Ernst Happel,Herbert Prohaska,4,Sport,sindelar,,,,,,
S,77,Quel est le nom de cet acteur ?,Hugh Jackman,Russell Crowe,Christian Bale,Gerard Butler,2,Cinéma & Séries,jackman,,,,,,
S,78,Quel est le nom de cette actrice ?,Rachel McAdams,Evangeline Lilly,Isla Fisher,Rachel Weisz,2,Cinéma & Séries,mcadams,,,,,,
S,,Dans quel pays se situe la ville de Cuzco (~ 440 000 hab.) ?,Le Pérou,Le Mexique,La Bolivie,La Colombie,2,Géographie,-,,,,,,
S,,"Dans quel pays se situe la ville de Caracas (~ 3,5 millions hab.) ?",Le Venezuela,La Colombie,Le Mexique,L'Équateur,2,Géographie,-,,,,,,
S,,"Dans quel pays se situe la ville de Manaus (~ 2,2 millions hab.) ?",Le Brésil,La Colombie,Le Venezuela,Le Suriname,2,Géographie,-,,,,,,
S,,"Dans quel pays se situe la ville de Monterrey (~ 1,1 million hab.) ?",Le Mexique,L'Argentine,Les États-Unis,L'Espagne,2,Géographie,-,,,,,,
S,,"Dans quel pays se situe la ville de Conakry (~ 2,3 millions hab.) ?",La Guinée,Le Liberia,Le Ghana,Le Sénégal,3,Géographie,-,,,,,,
S,79,Quel est le nom de cet acteur ?,Joaquin Phoenix,Jared Leto,Christian Bale,Adrien Brody,2,Cinéma & Séries,phoenix | joaquin rafael bottom,,,,,,
S,80,Quel est le nom de cet acteur ?,Elijah Wood,Tobey Maguire,Daniel Radcliffe,Dominic Monaghan,2,Cinéma & Séries,wood,,,,,,
S,81,Quel est le nom de cette actrice ?,Zoe Saldaña,Rosario Dawson,Zendaya,Halle Berry,2,Cinéma & Séries,saldana,,,,,,
S,82,Quel est le nom de cet acteur ?,Daniel Craig,Pierce Brosnan,Roger Moore,Sean Connery,2,Cinéma & Séries,craig,,,,,,
S,83,Quel est le nom de cet acteur ?,Harrison Ford,Kevin Costner,Mel Gibson,Tommy Lee Jones,2,Cinéma & Séries,ford,,,,,,
S,84,Quel est le nom de cet acteur ?,Daniel Radcliffe,Elijah Wood,Tom Felton,Robert Pattinson,1,Cinéma & Séries,radcliffe,,,,,,
S,85,Quel est le nom de cette actrice ?,Gwyneth Paltrow,Nicole Kidman,Naomi Watts,Cameron Diaz,2,Cinéma & Séries,paltrow,,,,,,
S,86,Quel est le nom de cette actrice ?,Kate Winslet,Julianne Moore,Nicole Kidman,Cate Blanchett,2,Cinéma & Séries,winslet,,,,,,
S,87,Quel est le nom de cette actrice ?,Margot Robbie,Cara Delevingne,Amber Heard,Scarlett Johansson,2,Cinéma & Séries,robbie,,,,,,
S,,Quel nom porte le code éthique qui régissait la vie et les valeurs des samouraïs ?,Le bushido,Le seppuku,Le shogunat,Le kabuki,3,Histoire,-,,,,,,
S,,"Quel est le nom de la première girafe arrivée en France, offerte à Charles X en 1827 ?",Zarafa,Soukaina,Nubia,Kafira,3,Histoire,-,,,,,,
S,,Comment s’appelait l’impôt obligatoire sur le sel appliqué jusqu'à la Révolution française ?,La gabelle,La dîme,Le cens,La taille,3,Histoire,gabelle du sel,,,,,,
S,,"Quel roi de France est surnommé le ""Roi-Soleil"" ?",Louis XIV,François Ier,Henri IV,Louis XVI,1,Histoire,louis 14,1,,,,,
S,,"Quel baron de la drogue colombien, chef du cartel de Medellín, était surnommé le ""roi de la cocaïne"" ?",Pablo Escobar,Griselda Blanco,Joaquín Guzmán,Carlos Lehder,1,Histoire,escobar,,,,,,
S,,Quelle est la capitale de l'Australie ?,Canberra,Sydney,Melbourne,Brisbane,2,Géographie,-,,,,,,
S,,Quel est l’organe interne le plus lourd du corps humain ?,Le foie,Le coeur,Le cerveau,Les poumons,2,Sciences de la vie,-,,,,,,
S,,Quelle est la plus grande planète du système solaire ?,Jupiter,Saturne,Terre,Neptune,1,Sciences exactes,-,,,,,,
S,,Quel scientifique britannique a découvert la pénicilline en 1928 ?,Alexander Fleming,Edward Jenner,Robert Koch,Joseph Lister,3,Sciences exactes,fleming,,,,,,
S,,Quel scientifique est à l’origine de la théorie de la relativité restreinte et générale ?,Albert Einstein,Isaac Newton,Niels Bohr,Stephen Hawking,1,Sciences exactes,einstein,,,,,,
S,,"Quel acteur interprète le rôle de James Bond dans ""Goldfinger"" (1964) ?",Sean Connery,Pierce Brosnan,Roger Moore,Timothy Dalton,2,Cinéma & Séries,connery,,,,,,
S,,"Donnez la bonne orthographe de ce mot : ""lo-go-ré""",Logorrhée,Laugorré,Loggaurée,Laughoré,2,Littérature,-,,,,,,
S,,"Donnez la bonne orthographe de ce mot : ""ko-ro-bo-ré""",Corroborer,Coroborrer,Corroborrer,Coroborer,2,Littérature,corroboré,,,,,,
S,,"Donnez la bonne orthographe de ce mot : ""é-ki-moz""",Ecchymose,Echymose,Ecchimose,Echimose,2,Littérature,-,,,,,,
S,,"Donnez la bonne orthographe de ce mot : ""a-ka-bi""",Acabit,Acabbi,Acabis,Accabis,2,Littérature,-,,,,,,
S,,"Quelle sauce chaude française est préparée avec du beurre, des jaunes d’œufs, de l’estragon et des échalotes ?",La sauce béarnaise,La sauce bordelaise,La sauce gribiche,La sauce tartare,2,Gastronomie,bearnaise,,,,,,
S,,"Quel est le nom de ce personnage du jeu ""Overwatch"" (2016) ?",Reinhardt,Bastion,Doomfist,Torbjörn,3,Jeux & BD,reinhardt wilhelm,,,,,,
S,89,Quel est le nom de cette actrice ?,Diane Kruger,Keira Knightley,Naomi Watts,Eva Green,2,Cinéma & Séries,kruger | diane heidkruger | heidkruger,,,,,,
S,90,Quel est le nom de cette actrice ?,Sophie Marceau,Isabelle Adjani,Emmanuelle Béart,Juliette Binoche,2,Cinéma & Séries,marceau | sophie maupu | maupu,,,,,,
S,91,Quel est le nom de cette actrice ?,Meryl Streep,Sigourney Weaver,Susan Sarandon,Jessica Lange,2,Cinéma & Séries,streep,,,,,,
S,92,Quel est le nom de cet acteur ?,Bruce Willis,Harrison Ford,Chuck Norris,Sylvester Stallone,1,Cinéma & Séries,willis | walter bruce willis,,,,,,
S,93,Quel est le nom de cette actrice ?,Kaya Scodelario,Natalie Dormer,Lily Collins,Emma Watson,3,Cinéma & Séries,scodelario | humphrey,,,,,,
S,,"Quelle sauce française à base d’œufs durs, de moutarde et de fines herbes, accompagne souvent la tête de veau ?",La sauce gribiche,La sauce béarnaise,La sauce aïoli,La sauce hollandaise,2,Gastronomie,gribiche,,,,,,
S,,Quelle sauce française à base de beurre d’écrevisse accompagne traditionnellement les quenelles de brochet ?,La sauce Nantua,La sauce gribiche,La sauce mornay,La sauce américaine,3,Gastronomie,nantua,,,,,,
S,,Quel système d’exploitation mobile développé par Google est utilisé sur la majorité des smartphones dans le monde ?,Android,iOS,Symbian,Windows Phone,1,Technologie,-,,,,,,
S,,Quel système d’exploitation développé par Microsoft est le plus répandu sur les ordinateurs personnels ?,Windows,Linux,Solaris,macOS,1,Technologie,-,,,,,,
S,,Quelles lignes horizontales imaginaires relient les points de même latitude sur un globe terrestre ?,Les parallèles,Les méridiens,Les isobares,Les fuseaux horaires,2,Géographie,parallele,,,,,,
S,,Quels oiseaux des îles Galápagos ont permis à Darwin de développer sa théorie de l’évolution ?,Les pinsons,Les ibis,Les cormorans,Les colibris,3,Sciences de la vie,pinson,,,,,,
S,,Quel savant français du XIXe siècle est l’auteur de la première grande théorie transformiste de l’évolution ?,Jean-Baptiste de Lamarck,Charles Darwin,Georges Cuvier,Gregor Mendel,3,Sciences de la vie,lamarck,,,,,,
S,,Quel officier de marine britannique a commandé le HMS Beagle lors du voyage de Charles Darwin autour du monde ?,Robert FitzRoy,Thomas Huxley,Matthew Flinders,Horatio Nelson,4,Divers,fitzroy,,,,,,
S,,Quel nom est donné à un entier naturel dont la somme des diviseurs propres est supérieure à lui-même ?,Un nombre abondant,Un nombre premier,Un nombre transcendant,Un nombre déficient,4,Sciences exactes,-,,,,,,
S,,"Quel compositeur italien est l'auteur de l'opéra ""La Traviata"" (1853) ?",Giuseppe Verdi,Gioachino Rossini,Gaetano Donizetti,Vincenzo Bellini,2,Musique,verdi,,,,,,
S,,"Quel hippodrome du bois de Boulogne accueille chaque année le ""Prix de l'Arc de Triomphe"" ?",L’hippodrome de Longchamp,L’hippodrome de Vincennes,L’hippodrome de Chantilly,L’hippodrome d’Auteuil,3,Sport,longchamp,,,,,,
S,94,Quel est le nom de cette plante à fleurs ?,Le coquelicot,La tulipe,L'anémone,Le géranium,2,Sciences de la vie,coquelicots | papaver rhoeas,,,,,,
S,,"Dans la mythologie grecque, quel est le royaume des morts qui n’ont pas péri au combat ?",Helheim,Valhalla,Muspelheim,Alfheim,3,Croyances,hel,,,,,,
S,,Quelle femme d’origine russe a été la muse et le grand amour de Salvador Dalí ?,Gala,Dora,Lou,Kiki,3,Arts & Culture,gala dali | elena ivanovna diakonova | diakonova,,,,,,
S,,Quel terme scientifique désigne le passage direct d'un corps de l'état solide à l'état gazeux ?,La sublimation,L'évaporation,La fusion,La condensation,2,Sciences exactes,-,,,,,,
S,,Quel terme scientifique désigne le passage d'un corps de l'état solide à l'état liquide ?,La fusion,La sublimation,La liquéfaction,La condensation,2,Sciences exactes,-,,,,,,
S,,"Quelle infection intestinale, bacillaire ou amibienne, provoque diarrhées sanglantes et fortes douleurs abdominales ?",La dysentrie,La gastro-entérite,La giardiase,La typhoïde,3,Sciences de la vie,-,,,,,,
S,,Quel président américain a démissionné en 1974 à la suite du scandale du Watergate ?,Richard Nixon,Gerald Ford,Lyndon B. Johnson,Herbert Hoover,2,Économie & Politique,nixon,,,,,,
S,,Quel est le nom spécifique donné aux excréments de loutre ?,L'épreinte,La moquette,La laissée,La fiente,4,Sciences de la vie,epreintes,,,,,,
S,95,Quel est le nom de cette race de chien ?,Le beagle,Le teckel,Le foxhound,Le jack russell terrier,2,Sciences de la vie,-,,,,,,
S,96,Quel est le nom de cette race de chien ?,Le caniche,Le bichon frisé,Le shih tzu,Le yorkshire terrier,2,Sciences de la vie,-,,,,,,
S,97,Quel est le nom de cette race de chien ?,Le shih tzu,Le pékinois,Le spitz nain,L'épagneul tibétain,2,Sciences de la vie,-,,,,,,
S,,Quel calendrier a été instauré en France en 1793 pour rompre avec les traditions monarchiques et religieuses ?,Le calendrier républicain,Le calendrier grégorien,Le calendrier julien,Le calendrier hégirien,2,Histoire,republicain | revolutionnaire | calendrier revolutionnaire,,,,,,
S,,Combien de mois comptait le calendrier républicain ?,12,9,15,18,2,Histoire,douze | 12 mois,1,,,,,
S,,Quel était le nom donné aux jours ajoutés en fin d’année dans le calendrier républicain pour compléter le cycle annuel ?,Les jours sans-culottides,Les épagomènes,Les intercalaires,Les jours fériés,4,Histoire,sans culottides | jour sans culottide | complementaire | jours complementaires,,,,,,
S,,Quel était le premier mois du calendrier républicain ?,Vendémiaire,Floréal,Thermidor,Nivôse,4,Histoire,-,,,,,,
S,,"Quel artiste interprète ""Save Your Tears"" (2020) ?",The Weeknd,Bruno Mars,Justin Bieber,Post Malone,2,Musique,abel tesfaye | tesfaye,,,,,,
S,,"Quel artiste interprète ""good 4 u"" (2021) ?",Olivia Rodrigo,Ariana Grande,Dua Lipa,Billie Eilish,2,Musique,rodrigo,,,,,,
S,,"Quel artiste interprète ""Kiss Me More"" (2021) ?",Doja Cat,Lizzo,Megan Thee Stallion,H.E.R.,2,Musique,sza | doja cat sza,,,,,,
S,,"Quel artiste interprète ""Happier Than Ever"" (2021) ?",Billie Eilish,Lana Del Rey,Banks,Lorde,2,Musique,eilish,,,,,,
S,98,Quel est le nom de cette chanteuse ?,Billie Eilish,Avril Lavigne,Halsey,Lorde,1,Musique,eilish,,,,,,
S,,"Quel artiste interprète ""Easy on Me"" (2021) ?",Adele,Kelly Clarkson,Alicia Keys,Jessie J,2,Musique,-,,,,,,
S,,"Quel artiste interprète ""Bad Habits"" (2021) ?",Ed Sheeran,Sam Smith,James Bay,George Ezra,2,Musique,sheeran,,,,,,
S,99,Quel est le nom de ce chanteur ?,Ed Sheeran,Damien Rice,Hozier,Vance Joy,1,Musique,sheeran,,,,,,
S,,"Quel rappeur interprète ""Astronaut in the Ocean"" (2019) ?",Masked Wolf,Kid Cudi,Juice WRLD,G-Eazy,2,Musique,harry michael | michael,,,,,,
S,,"Quelle artiste interprète ""MONEY"" (2021) ?",Lisa,Hwasa,Rosé,Jennie,2,Musique,pranpriya manobal | manobal | lalisa,,,,,,
S,,"Quel artiste interprète ""INDUSTRY BABY"" (2021) ?",Lil Nas X,Travis Scott,Drake,DaBaby,2,Musique,jack harlow | montero lamar hill,,,,,,
S,,"Quel DJ a composé ""The Business"" (2020) ?",Tiësto,Steve Aoki,Armin van Buuren,Kygo,3,Musique,tijs michiel verwest,,,,,,
S,,"Quelle rappeuse interprète ""Up"" (2021) ?",Cardi B,Nicki Minaj,Megan Thee Stallion,Iggy Azalea,2,Musique,belcalis marlenis almànzar | almanzar,,,,,,
S,100,Quel est le nom de cet album ?,The Dark Side of the Moon,The Wall,Fragile,Wish You Were Here,2,Musique,-,,,,,,
S,101,Quel est le nom de cet album ?,Nevermind,In Utero,Bleach,Dirt,2,Musique,-,,,,,,
S,102,Quel est le nom de cet album ?,Abbey Road,Revolver,Let It Be,Pet Sounds,2,Musique,-,,,,,,
S,103,Quel est le nom de cet album ?,Californication,By the Way,Stadium Arcadium,Superunknown,2,Musique,-,,,,,,
S,104,Quel groupe de punk rock britannique est à l’origine de cet album ?,The Clash,Sex Pistols,Buzzcocks,The Damned,2,Musique,-,,,,,,
S,105,Quelle chanteuse américaine est à l'origine de cet album ?,Cyndi Lauper,Madonna,Bonnie Tyler,Debbie Harry,2,Musique,lauper | cynthia lauper,,,,,,
S,106,Quelle chanteuse américaine est à l'origine de cet album ?,Beyoncé,Rihanna,Alicia Keys,Kelis,2,Musique,beyonce knowles | beyonce carter | knowles | carter,,,,,,
S,107,Quel groupe de pop-rock britannique est à l'origine de cet album ?,Fleetwood Mac,Supertramp,Led Zeppelin,The Police,3,Musique,-,,,,,,
S,108,Quel rappeur américain est à l'origine de cet album ?,Eminem,Dr. Dre,Jay-Z,Snoop Dogg,1,Musique,marshall bruce mathers iii | slim shady,,,,,,
S,109,Quel groupe de metal américain est à l'origine de cet album ?,Pantera,Metallica,Slayer,Machine Head,2,Musique,-,,,,,,
S,110,Quel rappeur français est à l'origine de cet album ?,Gazo,Koba LaD,Ninho,Damso,2,Musique,ibrahima diakite | diakite,,,,,,
S,111,Quel groupe de punk rock américain est à l'origine de cet album ?,Green Day,The Offspring,Bad Religion,Blink-182,2,Musique,-,,,,,,
S,112,Quel artiste est à l'origine de cet album ?,Hozier,James Bay,George Ezra,Rag’n’Bone Man,2,Musique,-,,,,,,
S,113,Quel chanteur de reaggaeton est à l'origine de cet album ?,Bad Bunny,Daddy Yankee,J Balvin,Ozuna,2,Musique,benito ocasio | ocasio,,,,,,
S,114,Quel est le nom de ce jeu vidéo ?,Pong,Breakout,Space Invaders,Asteroids,2,Jeux & BD,-,,,,,,
S,115,Quel est le nom de ce jeu vidéo ?,Space Invaders,Galaxian,Asteroids,Missile Command,2,Jeux & BD,-,,,,,,
S,116,Quel est le nom de ce jeu vidéo ?,Pac-Man,Dig Dug,Frogger,BurgerTime,1,Jeux & BD,-,,,,,,
S,117,Quel est le nom de ce jeu vidéo ?,Donkey Kong,Mario Bros.,Jungle Hunt,Popeye,2,Jeux & BD,-,,,,,,
S,118,Quel est le nom de ce jeu vidéo ?,Tetris,Bubble Bobble,Arkanoid,Columns,1,Jeux & BD,-,,,,,,
S,119,Quel est le nom de ce jeu vidéo ?,Shovel Knight,Celeste,Braid,Dead Cells,3,Jeux & BD,-,,,,,,
S,120,Quel est le nom de ce jeu vidéo ?,Celeste,Super Meat Boy,Ori and the Blind Forest,Hollow Knight,3,Jeux & BD,-,,,,,,
S,121,Quel est le nom de ce jeu vidéo ?,Ori and the Blind Forest,Child of Light,Limbo,Rayman Legends,3,Jeux & BD,-,,,,,,
S,122,Quel est le nom de ce jeu vidéo ?,Castlevania,Metroid,Kid Icarus,Ninja Gaiden,3,Jeux & BD,-,,,,,,
S,123,Quel est le nom de ce jeu vidéo ?,Dead Cells,Hades,The Binding of Isaac,Rogue Legacy,3,Jeux & BD,-,,,,,,
S,124,Quel est le nom de ce jeu vidéo ?,Angry Birds,Cut the Rope,Plants vs. Zombies,Flappy Bird,2,Jeux & BD,-,,,,,,
S,125,Quel est le nom de ce jeu vidéo ?,The Binding of Isaac,Don’t Starve,Enter the Gungeon,Rogue Legacy,2,Jeux & BD,-,,,,,,
S,126,Quel est le nom de ce jeu vidéo ?,Super Meat Boy,VVVVVV,Celeste,The End Is Nigh,3,Jeux & BD,-,,,,,,
S,127,Quel est le nom de ce jeu vidéo ?,Stardew Valley,Harvest Moon,Animal Crossing,Terraria,3,Jeux & BD,-,,,,,,
S,128,Quel est le nom de ce jeu vidéo ?,Rogue Legacy,Enter the Gungeon,Spelunky,Salt and Sanctuary,3,Jeux & BD,-,,,,,,
S,129,Quel est le nom de ce jeu vidéo ?,Clash of Clans,Clash Royale,Boom Beach,Rise of Kingdoms,2,Jeux & BD,-,,,,,,
S,130,Quel est le nom de ce jeu vidéo ?,Fruit Ninja,Doodle Jump,Cut the Rope,Angry Birds,2,Jeux & BD,-,,,,,,
S,131,Quel est le nom de ce jeu vidéo ?,Temple Run,Subway Surfers,Jetpack Joyride,Crossy Road,2,Jeux & BD,-,,,,,,
S,132,Quel est le nom de ce jeu vidéo ?,Plants vs. Zombies,Bloons TD,Zombie Tsunami,Fieldrunners,2,Jeux & BD,plants versus zombies | pvz,,,,,,
S,133,Quel est le nom de ce jeu vidéo ?,Subway Surfers,Temple Run,Jetpack Joyride,Minion Rush,2,Jeux & BD,-,,,,,,
S,134,Quel est le nom de ce jeu vidéo ?,Slay the Spire,Monster Train,Darkest Dungeon,Into the Breach,3,Jeux & BD,-,,,,,,
S,135,Quel est le nom de ce jeu vidéo ?,Don't Starve,The Forest,Rust,Terraria,3,Jeux & BD,-,,,,,,
S,136,Quel est le nom de ce jeu vidéo ?,Doodle Jump,Angry Birds,Flappy Bird,Jetpack Joyride,1,Jeux & BD,-,,,,,,
S,137,Quel est le nom de ce jeu vidéo ?,Among Us,Fall Guys,Roblox,Minecraft,2,Jeux & BD,-,,,,,,
S,138,À quel pays appartient ce drapeau ?,L'Italie,L'Irlande,Le Mexique,La Bulgarie,1,Géographie,-,,,,,,
S,2,À quel pays appartient ce drapeau ?,La France,La Russie,Les Pays-Bas,La Slovaquie,1,Géographie,-,,,,,,
S,139,À quel pays appartient ce drapeau ?,L'Espagne,Le Portugal,La Colombie,Le Venezuela,1,Géographie,-,,,,,,
S,140,À quel pays appartient ce drapeau ?,Le Portugal,Le Brésil,Le Mexique,L'Espagne,1,Géographie,-,,,,,,
S,141,À quel pays appartient ce drapeau ?,L'Ukraine,La Suède,La Roumanie,La Mongolie,2,Géographie,-,,,,,,
S,142,À quel pays appartient ce drapeau ?,L'Autriche,La Lettonie,La Pologne,Le Danemark,2,Géographie,-,,,,,,
S,143,À quel pays appartient ce drapeau ?,La Chine,Le Vietnam,La Corée du Sud,Singapour,1,Géographie,-,,,,,,
S,144,À quel pays appartient ce drapeau ?,L'Inde,L'Iran,Le Niger,L'Irlande,1,Géographie,-,,,,,,
S,145,À quel pays appartient ce drapeau ?,Le Japon,La Corée du Sud,L'Indonésie,Le Bangladesh,1,Géographie,-,,,,,,
