type,img,question,A,B,C,D,difficulte,theme,fuzzy,exact,,,,,
S,3,Quel est le nom de cet acteur ?,Brad Pitt,Leonardo DiCaprio,Johnny Depp,Matt Damon,1,Cinéma & Séries,pitt | william bradley pitt,,,,,,
S,4,Quel est le nom de cet acteur ?,Robert Redford,Dustin Hoffman,Paul Newman,Steve McQueen,3,Cinéma & Séries,redford | charles robert redford jr,,,,,,
S,1,Quel est le nom de cette peinture ?,La Joconde,La Nuit étoilée,Les Tournesols,Guernica,1,Arts & Culture,monna lisa | portrait de monna lisa,,,,,,
S,,Quel est l'aliment préféré des Tortues Ninja ?,Les pizzas,Les hot-dogs,Les sushis,Les burgers,2,Cinéma & Séries,pizza,,,,,,
S,,Quel héros de bande dessinée tire plus vite que son ombre ?,Lucky Luke,Spirou,Tintin,Astérix,1,Jeux & BD,-,,,,,,
S,,Dans quel pays se situe la ville de Sfax ?,La Tunisie,Le Maroc,La Libye,L'Égypte,3,Géographie,republique tunisienne,,,,,,
S,,Quel pays africain doit son nom à l'abondance de crevettes dans ses rivières ?,Le Cameroun,Le Mozambique,La Gambie,L'Angola,3,Géographie,-,,,,,,
S,,Que casse-t-on traditionnellement à la fin d'un mariage juif ? ,Un verre,Une assiette,Une bouteille,Un miroir,3,Croyances,-,,,,,,
S,,Quel est le symbole chimique du sodium dans le tableau périodique des éléments ?,Na,S,So,Cl,2,Sciences exactes,-,1,,,,,
S,,"Quel prix littéraire, décerné depuis 1937, distingue chaque année un recueil de poésie en langue française ?",Prix Mallarmé,Prix Renaudot,Prix Goncourt,Prix Lamartine,3,Littérature,mallarme,,,,,,
S,,Quelle est la couleur d'un billet de 50 euros ?,Orange,Rouge,Jaune,Vert,1,Économie & Politique,-,,,,,,
S,,À quel élément est associé le signe astrologique du Scorpion ?,Eau,Terre,Feu,Air,3,Croyances,-,,,,,,
S,,"Quel café associe espresso, mousse de lait et chocolat saupoudré ?",Le cappuccino,Le café viennois,Le moka,Le latte macchiato,2,Gastronomie,-,,,,,,
S,,"Quel est le nom français du ""french toast"" ?",Le pain perdu,Le croque-monsieur,La quiche lorraine,La tarte Tatin,2,Gastronomie,-,,,,,,
S,,"Quelle entreprise américaine a été fondée par Steve Jobs, Steve Wozniak et Ronald Wayne en 1976 ?",Apple,Google,IBM,Microsoft,1,Économie & Politique,apple inc | apple computer | apple computer inc,,,,,,
S,,Quel dieu égyptien est représenté avec une tête de chacal et est associé à la mort ?,Anubis,Osiris,Seth,Horus,2,Croyances,-,,,,,,
S,,Quelle civilisation antique a construit la cité de Machu Picchu ?,Les Incas,Les Aztèques,Les Mayas,Les Toltèques,3,Histoire,inca | civilisation inca,,,,,,
S,,Quel skipper a remporté l'édition 2020 du Vendée Globe ?,Yannick Bestaven,Charlie Dalin,Thomas Ruyant,Clarisse Crémer,3,Sport,bestaven,,,,,,
S,,Avec quel pays l’Ukraine a-t-elle organisé l’Euro 2012 de football ?,La Pologne,La Roumanie,La Hongrie,La Russie,2,Sport,-,,,,,,
S,,De quel arbre la faine est-elle le fruit ?,Le hêtre,Le frêne,Le chêne,Le châtaignier,3,Sciences de la vie,fagus | fagus sylvatica,,,,,,
S,,"Quel animal marin porte le surnom de ""licorne des mers"" ?",Le narval,Le béluga,L'espadon,Le marlin,3,Sciences de la vie,-,,,,,,
S,,Pour quel film Leonardo DiCaprio a-t-il remporté l'Oscar du meilleur acteur ?,The Revenant,Titanic,Inception,Le Loup de Wall Street,2,Cinéma & Séries,revenant,,,,,,
S,,Quelle lettre est le surnom de l'école Polytechnique ?,X,W,Y,Z,2,Divers,-,1,,,,,
S,,Dans quel pays africain le Lesotho est-il enclavé ?,Afrique du Sud,Mozambique,Zimbabwe,Congo,2,Géographie,-,,,,,,
S,,Quel footballeur a remporté le tout premier Ballon d’or en 1956 ?,Stanley Matthews,Raymond Kopa,Lev Yachine,Alfredo Di Stéfano,4,Sport,matthews,,,,,,
S,,Quel scientifique a identifié le bacille responsable de la tuberculose en 1882 ?,Robert Koch,Louis Pasteur,Alexander Fleming,Joseph Lister,3,Sciences exactes,koch,,,,,,
S,,Dans quel pays se situe le volcan Krakatoa ?,Indonésie,Japon,Malaisie,Philippines,4,Géographie,-,,,,,,
S,,Quelle est la forme caractéristique de la badiane ?,Une étoile,Une spirale,Un coeur,Une cloche,3,Sciences de la vie,etoiles,,,,,,
S,,Quel est le nom de l’alliage métallique fer-nickel connu pour sa très faible dilatation thermique ?,L'invar,Le cupro-nickel,L'alpax,L'acier,4,Sciences exactes,-,,,,,,
S,,Quel est le nom de l’alliage formé de cuivre et d'étain ?,Le bronze,Le laiton,L'acier,Le titane,2,Sciences exactes,-,,,,,,
S,,Quel est le nom de l’alliage formé de cuivre et de zinc ?,Le laiton,Le bronze,L'acier,Le titane,3,Sciences exactes,-,,,,,,
S,,Quel métal est connu pour rouiller au contact de l’air et de l’humidité ?,Le fer,Le cuivre,L'argent,Le zinc,2,Sciences exactes,fe,,,,,,
S,,"Quel aristocrate subit l’emprise financière et affective de l'héroïne dans le roman ""Nana"" (1879) ?",Le comte Muffat,Le baron Hulot d'Ervy,Le duc de Guermantes,Le marquis de La Mole,4,Littérature,muffat | xavier de muffat | comte xavier de muffat,,,,,,
S,,"Dans quel théâtre parisien l'héroïne fait-elle ses débuts dans le roman ""Nana"" (1879) ?",Le Théâtre des Variétés,La Comédie-Française,Le Théâtre du Châtelet,L'opéra Garnier,4,Littérature,varietes,,,,,,
S,,"Quel dramaturge français a écrit ""Le Cid"" (1637) ?",Pierre Corneille,Jean Racine,Edmond Rostand,Molière,2,Littérature,corneille,,,,,,
S,,Quel archéologue a découvert la tombe de Toutânkhamon en 1922 ?,Howard Carter,Jean-François Champollion,Theodore M. Davis,Richard Lepsius,3,Histoire,carter,,,,,,
S,,"Quel restaurant parisien, fondé par Bernard Pacau, est triplement étoilé au Guide Michelin depuis 1988 ?",L'Ambroisie,Le Clos des Sens,Auberge du Vieux Puits,Arpège,4,Gastronomie,-,,,,,,
S,,"Quel chef cuisinier lyonnais est surnommé ""le pape de la gastronomie"" ? ",Paul Bocuse,Joël Robuchon,Alain Ducasse,Michel Guérard,3,Gastronomie,bocuse,,,,,,
S,,"Quel chef cuisinier français est surnommé ""le roi des cuisiniers et cuisinier des rois"" ?",Marie-Antoine Carême,Paul Bocuse,Auguste Escoffier,Joël Robuchon,3,Gastronomie,antonin careme | careme,,,,,,
S,,Quel est le seul membre de la famille des canidés capable d'hiberner ?,Le tanuki,Le renard roux,Le loup gris,Le lycaon,4,Sciences de la vie,chien viverrin | nyctereutes procyonoides,,,,,,
S,,"Quel homme a assassiné John Lennon devant son domicile new-yorkais, le 8 décembre 1980 ?",Mark David Chapman,Lee Harvey Oswald,James Earl Ray,John Hinckley Jr.,3,Actualités & Médias,chapman,,,,,,
S,,"Quel alcool écossais est obtenu par distillation d'orge maltée, puis vieilli en fûts de chêne ?",Le whisky,Le gin,La vodka,Le bourbon,2,Gastronomie,scotch | scotch whisky | whiskey,,,,,,
S,,Qui est la première femme à avoir remporté la Route du Rhum en 1990 ?,Florence Arthaud,Ellen MacArthur,Isabelle Autissier,Samantha Davies,3,Sport,arthaud,,,,,,
S,,"Quel mat, réalisable en quatre coups, est souvent le premier appris par les nouveaux joueurs d’échecs ?",Le mat du berger,Le mat du couloir,Le mat de Boden,Le mat du sot,3,Jeux & BD,berger,,,,,,
S,,Quel skipper a disparu en mer lors de la première édition de la Route du Rhum en 1978 ?,Alain Colas,Éric Tabarly,Loïc Caradec,Donald Crowhurst,4,Sport,colas,,,,,,
S,,Quel skipper a remporté la première édition de la Route du Rhum en 1978 ?,Mike Birch,Michel Malinovsky,Alain Colas,Bruno Peyron,4,Sport,birch,,,,,,
S,,Quel est le deuxième prénom d'Elvis Presley ?,Aaron,Robert,Lee,Joseph,4,Musique,-,,,,,,
S,,Quelle est la capitale de l'État américain de Californie ?,Sacramento,Los Angeles,San Francisco,Fresno,3,Géographie,-,,,,,,
S,,Qui est l’inventeur du système d’écriture tactile à points utilisé par les personnes non voyantes ?,Louis Braille,Valentin Haüy,Charles Barbier,Auguste Bébian,3,Technologie,braille,,,,,,
S,,Que veut dire D.C. dans Washington D.C. ?,District of Columbia,District of California,District of Colorado,District of Connecticut,3,Géographie,district columbia,,,,,,
S,,Quelle couleur de fumée annonce l'élection d'un nouveau pape ?,Blanche,Noire,Verte,Rouge,2,Croyances,blanc,,,,,,
S,,Dans quelle ville se situe la bibliothèque Bodléienne ?,Oxford,Londres,Cambridge,Exeter,4,Divers,-,,,,,,
S,,Quel alcool est élaboré à partir de la distillation de l'agave bleu ?,La tequila,Le rhum,La vodka,Le whisky,3,Gastronomie,-,,,,,,
S,,"Quelle petite pastille noire, à base de réglisse, est connue pour parfumer l’haleine ?",Le cachou,Le salmiakki,La pastille de Vichy,La gomme arabique,3,Gastronomie,cachous,,,,,,
S,,Quelle confiserie orientale est composée de pâte gélifiée parfumée et recouverte de sucre glace ?,Le loukoum,Le baklava,Le mochi,Le halva,3,Gastronomie,loukoums,,,,,,
S,,Quelle astronaute a été la première femme française à aller dans l'espace en 1996 ?,Claudie Haigneré,Hélène Courtois,Samantha Cristoforetti,Françoise Combes,3,Actualités & Médias,haignere | claudie andre deshays | andre deshays,,,,,,
S,,"Quelle personnalité britannique est à la tête du magazine ""Vogue"" aux États-Unis depuis 1988 ?",Anna Wintour,Miuccia Prada,Donatella Versace,Tom Ford,3,Économie & Politique,wintour,,,,,,
S,,Quelle est la deuxième plus grande ville de Corée du Sud par sa population ?,Busan,Séoul,Incheon,Daegu,3,Géographie,-,,,,,,
S,,Quelle est la deuxième plus grande ville du Danemark par sa population ?,Aarhus,Copenhague,Odense,Aalborg,4,Géographie,-,,,,,,
S,,Quel mode de reproduction est caractérisé par la gestation dans l'organisme maternel ?,La viviparité,L'oviparité,L'ovoviviparité,La parthénogenèse,3,Sciences de la vie,vivipare,,,,,,
S,,Quelle discipline scientifique se consacre à l’observation et à l’analyse du comportement animal ?,L'éthologie,La zoologie,La bionomie,L'anthropologie,3,Sciences de la vie,-,,,,,,
S,,Comment désigne-t-on la tendance naturelle de certains animaux à former des groupes ?,Le grégarisme,Le mimétisme,Le nomadisme,Le mutualisme,3,Sciences de la vie,gregaire,,,,,,
S,,Quel footballeur colombien a été assassiné après avoir marqué contre son camp lors du Mondial 1994 ?,Andrés Escobar,Carlos Valderrama,René Higuita,Freddy Rincón,3,Sport,escobar | andres escobar saldarriaga,,,,,,
S,,"Quel personnage du jeu ""Animal Crossing"" occupe le rôle de maire avant le joueur ?",Tortimer,Thibou,Amiral,Tom Nook,4,Jeux & BD,-,,,,,,
S,,Quel monument garde l’entrée du plateau de Gizeh ?,Le Grand Sphinx,La statue de Ramsès II,Le colosse de Memnon,L'obélisque de Louxor,2,Géographie,sphinx | grand sphinx de gizeh,,,,,,
S,,Quelle est la plus imposante des pyramides situées sur le plateau de Gizeh ?,La pyramide de Khéops,La pyramide de Khéphren,La pyramide de Mykérinos,La pyramide de Djoser,2,Géographie,kheops,,,,,,
S,,Dans quel pays se trouvent les pyramides de Meroë ?,Le Soudan,L'Égypte,La Libye,Le Tchad,3,Géographie,republique du soudan,,,,,,
S,,"Dans quel pays se trouvent les pyramides de Khéops, Khéphren et Mykérinos ?",L'Égypte,Le Mexique,La Grèce,La Chine,1,Géographie,republique arabe d'egypte | egypte,,,,,,
S,,Quel tsar russe a lancé la construction du Transsibérien ?,Alexandre III,Nicolas II,Nicolas Ier,Pierre le Grand,4,Histoire,alexandre 3 | tsar alexandre iii | alexandre iii de russie,,,,,,
S,,Quel est le terminus oriental de la ligne du Transsibérien ?,Vladivostok,Moscou,Irkoutsk,Magadan,3,Géographie,-,,,,,,
S,,Quel animal cacarde ?,L'oie,Le canard,La poule,La dinde,2,Sciences de la vie,-,,,,,,
S,,Quelle est la capitale du Cameroun ?,Yaoundé,Douala,Abuja,Libreville,3,Géographie,-,,,,,,
S,,Quelle est la capitale de l'Angola ?,Luanda,Windhoek,Benguela,Kampala,3,Géographie,-,,,,,,
S,,Quel auteur français a décliné le prix Nobel de littérature qu’il avait remporté en 1964 ?,Jean-Paul Sartre,Albert Camus,François Mauriac,André Gide,3,Littérature,sartre,,,,,,
S,,"Qui écrit ""Le Crime de Sylvestre Bonnard"" et a été honoré du prix Nobel de littérature en 1921 ?",Anatole France,André Gide,Romain Rolland,Maurice Maeterlinck,4,Littérature,france | françois anatole thibault,,,,,,
S,,"Comment s’appelle la forme poétique japonaise composée de trois vers de 5, 7 et 5 syllabes ?",Le haïku,Le tanka,Le renga,Un haïbun,3,Littérature,haikus,,,,,,
S,,Quelle unité de mesure du Système international sert à exprimer la charge électrique ?,Le coulomb,Le farad,Le joule,L'ampère,3,Sciences exactes,-,,,,,,
S,,Quelle unité de mesure du Système international sert à exprimer la résistance électrique ?,L'ohm,Le farad,L'ampère,Le volt,2,Sciences exactes,-,,,,,,
S,,Quelle plante est traditionnellement associée à la Saint-Patrick et à l’Irlande ?,Le trèfle,La jonquille,La rose,Le chardon,2,Croyances,trefles,,,,,,
S,,Quelle fête chrétienne commémore la présentation de Jésus au Temple ?,La Chandeleur,L'Épiphanie,Mardi Gras,La Pentecôte,3,Croyances,-,,,,,,
S,,"Quelle fête française, célébrée le 2 février, est associée à la dégustation de crêpes ?",La Chandeleur,L'Épiphanie,Mardi Gras,La Pentecôte,2,Gastronomie,-,,,,,,
S,,Quel dessert à base de chocolat et de cerises porte le nom d’une région allemande ?,La forêt-noire,La pavlova,Le strudel,Le saint-honoré,2,Gastronomie,-,,,,,,
S,,Quel herbivore africain combine l’allure d’une girafe et les rayures d’un zèbre ?,L'okapi,Le kudu,Le bongon,Le gnou,3,Sciences de la vie,okapis,,,,,,
S,,Quelle course à la voile en solitaire relie Saint-Malo à Pointe-à-Pitre depuis 1978 ?,La Route du Rhum,La Transat Café L'Or,La Solitaire du Figaro,Le Vendée Globe,2,Sport,-,,,,,,
S,,Quel plat écossais est composé de panse de brebis et de farce aux abats et à l’avoine ?,Le haggis,Le black pudding,Le sheperd's pie,Le Cornish pasty,3,Gastronomie,-,,,,,,
S,,Quel plat milanais est composé de jarret de veau cuit lentement avec légumes et sauce tomate ?,L'osso buco,Le saltimbocca,Le bollito misto,Le cacciatore,3,Gastronomie,ossobuco,,,,,,
S,,"Quel plat maghrébin est composé de tomates, poivrons, oignons et oeufs pochés ?",La chakchouka,La harira,Le menemen,Le tajine,4,Gastronomie,shakshuka | chakchuka,,,,,,
S,,Quel est le nom du supercontinent unique qui existait il y a environ 300 millions d'années ?,La Pangée,La Laurasie,Le Gondwana,Le Panthalassa,2,Histoire,-,,,,,,
S,,Dans quel type d’aliment trouve-t-on naturellement la capsaïcine ?,Les piments,Les oignons,Les radis,Les gingembres,2,Gastronomie,piment | capsicum,,,,,,
S,,Quel composé chimique est responsable de la sensation de brûlure lorsqu’on mange des piments ?,La capsaïcine,La pipérine,L'allicine,La sinephrine,3,Gastronomie,-,,,,,,
S,,Quelle fête juive commémore l'exode des Hébreux hors d'Égypte ?,Pessa'h,Yom Kippour,Hanoucca,Roch Hachana,3,Croyances,pessah,,,,,,
S,,Quelle chaîne de montagnes est associée à la légende du yéti ?,L'Himalaya,Les Andes,Les Carpates,Le Caucase,1,Croyances,-,,,,,,
S,,Comment s’appelle la fête hindoue des lumières qui symbolise la victoire du bien sur le mal ?,Diwali,Navrati,Holi,Pongal,3,Croyances,divali | deepavali,,,,,,
S,,Quelle combinaison de couleurs est utilisée pour reconnaître le fil de terre ?,Vert et jaune,Jaune et bleu,Bleu et Rouge,Rouge et vert,3,Sciences exactes,jaune vert | vert jaune | jaune et vert,,,,,,
S,,"Complétez cette expression : ""Faute avouée...""",À moitié pardonnée,N'est pas jugée,Est vite oubliée,Vaut d'être excusée,1,Littérature,-,,,,,,
S,,"Complétez cette expression : ""Abondance de biens...""",Ne nuit pas,Rend heureux,N'apporte rien,Attire l'envie,2,Littérature,-,,,,,,
S,,"Complétez cette expression : ""Il n'y a pas de fumée...""",Sans feu,Sans chaleur,Sans flamme,Sans braise,1,Littérature,-,,,,,,
S,,"Complétez cette expression : ""Qui sème le vent...""",Récolte la tempête,Récolte la foudre,Récolte la poussière,Récolte la pluie,2,Littérature,-,,,,,,
S,,"Complétez cette expression : ""Petit à petit...""",L'oiseau fait son nid,La rivière fait son lit,Le temps fait son tri,Le vent fait son bruit,2,Littérature,-,,,,,,
S,,"Complétez cette expression : ""Quand le chat n'est pas là...""",Les souris dansent,Les oiseaux chantent,Les chiens aboient,La maison dort,1,Littérature,-,,,,,,
S,,"Complétez cette expression : ""L'habit ne fait pas...""",Le moine,Le roi,Le héros,L'homme,1,Littérature,-,,,,,,
S,,"Complétez cette expression : ""Chat échaudé...""",Craint l'eau froide,Miaule sans raison,Sauve sa peau,Cherche un abri,2,Littérature,-,,,,,,
S,,Quelle langue créée en 1887 par Zamenhof vise à faciliter la communication internationale ?,L'espéranto,Le volapük,Le quenya,Le klingon,2,Littérature,-,,,,,,
S,,Quelle lettre marque la terminaison des adverbes en espéranto ?,e,a,o,i,3,Littérature,le e,1,,,,,
S,,Quelle lettre marque la terminaison des adjectifs en espéranto ?,a,o,e,u,3,Littérature,le a,1,,,,,
S,,Quelle lettre marque le pluriel des noms en espéranto ?,j,x,k,n,3,Littérature,le j,1,,,,,
S,,Comment se nomme l’hymne adopté par les locuteurs d’espéranto du monde entier ?,La Espero,La Pacflago,Internacia Kanto,"Unu Mondo, Unu Lingvo",4,Musique,-,,,,,,
S,,Quel linguiste a inventé la langue espéranto ?,Louis-Lazare Zamenhof,Johann Martin Schleyer,Marc Okrand,J.R.R. Tolkien,4,Littérature,zamenhof | ludwik zamenhof | ludwik lejzer zamenhof,,,,,,
S,,"Qui est le créateur original du jeu ""The Binding of Isaac"" ?",Edmund McMillen,Markus Persson,Tommy Refenes,Eric Barone,3,Jeux & BD,mcmillen,,,,,,
S,,"Quelle est la couleur du bandeau de Michelangelo dans la série ""Les Tortues Ninja"" ?",Orange,Bleu,Rouge,Violet,2,Cinéma & Séries,-,,,,,,
S,,"Quelle est la couleur du bandeau de Donatello dans la série ""Les Tortues Ninja"" ?",Violet,Orange,Rouge,Bleu,2,Cinéma & Séries,-,,,,,,
S,,"Quelle est la couleur du bandeau de Leonardo dans la série ""Les Tortues Ninja"" ?",Bleu,Orange,Rouge,Violet,2,Cinéma & Séries,-,,,,,,
S,,"Quel psychanalyste et pédiatre est connu pour son ouvrage ""Lorsque l’enfant paraît"" ?",Françoise Dolto,Maria Montessori,Maud Mannoni,Melanie Klein,3,Littérature,dolto,,,,,,
S,,Quel tissu végétal a pour rôle d’acheminer la sève produite par les feuilles vers le reste de la plante ?,Le phloème,Le cambium,Le parenchyme,Le périderme,4,Sciences de la vie,-,,,,,,
S,,"De quel pays est originaire Tony Montana dans le film ""Scarface"" (1983) ?",Cuba,La Colombie,Le Mexique,La Bolivie,3,Cinéma & Séries,-,,,,,,
S,,"Quelle couleur a une nuance nommée ""céladon"" ?",Le vert,Le jaune,Le rouge,Le blanc,2,Arts & Culture,-,,,,,,
S,,Quel est le pays d’origine de l’avocatier ?,Le Mexique,Le Brésil,Le Chili,La Colombie,2,Sciences de la vie,-,,,,,,
S,,Dans quelle ville est situé le musée Van Gogh ?,Amsterdam,Paris,Bruxelles,Londres,2,Arts & Culture,-,,,,,,
S,,Dans quel État américain est située la Silicon Valley ?,La Californie,Le Texas,New York,Le Massachussets,2,Technologie,-,,,,,,
S,,Dans quelle ville américaine est situé le Madison Square Garden ?,New York,Los Angeles,Chicago,Dallas,2,Géographie,-,,,,,,
S,,Dans quel pays se situe la ville d'Acapulco ?,Le Mexique,Le Pérou,Le Costa Rica,Les États-Unis,2,Géographie,-,,,,,,
S,,Dans quel sport joue-t-on avec une chistera ?,La pelote basque,Le polo,Le squash,Le hurling,3,Sport,-,,,,,,
S,,"Quel est le nom du mandrill qui conseille Simba dans le film ""Le Roi Lion"" (1994) ?",Rafiki,Zazu,Pumbaa,Timon,2,Cinéma & Séries,-,,,,,,
S,,Dans quel pays se situe la ville d'Antalya ?,La Turquie,La Grèce,L'Albanie,La Roumanie,2,Géographie,-,,,,,,
S,,Dans quel pays se situe la ville d'Izmir ?,La Turquie,La Syrie,L'Arménie,La Jordanie,3,Géographie,-,,,,,,
S,,Dans quel pays se situe la ville de Benghazi ?,La Libye,Le Liban,La Tunisie,L'Égypte,4,Géographie,-,,,,,,
S,,"Quel personnage du jeu ""Animal Crossing"" sert le café aux habitants ?",Robusto,Kéké Laglisse,Céleste,Porcelette,4,Jeux & BD,-,,,,,,
S,,"Quelle monnaie virtuelle est utilisée dans le jeu ""Animal Crossing"" ?",Les clochettes,Les rubis,Les étoiles,Les baies,3,Jeux & BD,clochette,,,,,,
S,,"Quel personnage du jeu ""Animal Crossing"" dirige le musée du village ?",Thibou,Amiral,Tom Nook,Robusto,4,Jeux & BD,-,,,,,,
S,,Quel physicien primé au Nobel est reconnu pour ses travaux sur l’intrication quantique ?,Alain Aspect,Serge Haroche,Claude Cohen-Tannoudji,Gérard Mourou,3,Sciences exactes,aspect,,,,,,
S,,"Quel homme politique italien a fondé le parti ""Forza Italia"" en 1994 ?",Silvio Berlusconi,Matteo Renzi,Matteo Salvini,Enrico Letta,2,Économie & Politique,berlusconi,,,,,,
S,,"Quel homme politique britannique a fondé le ""Brexit Party"" en 2019 ?",Nigel Farage,Jacob Rees-Mogg,Michael Gove,Dominic Cummings,3,Économie & Politique,farage | nigel paul farage,,,,,,
S,,"Quel homme politique français a fondé le ""Rassemblement pour la France"" (RPF) en 1999 ?",Charles Pasqua,Nicolas Dupont-Aignan,Alain Juppé,Jacques Chirac,3,Économie & Politique,pasqua,,,,,,
S,,"Quel homme politique français a fondé le parti ""La France insoumise"" en 2016 ?",Jean-Luc Mélenchon,Benoît Hamon,Manuel Bompard,François Ruffin,1,Économie & Politique,melenchon,,,,,,
S,,"Quel homme politique français a fondé le ""Front national"" en 1972 ?",Jean-Marie Le Pen,Carl Lang,Gilbert Collard,Bruno Mégret,1,Économie & Politique,le pen,,,,,,
S,,"Quel homme politique français a fondé le parti ""En Marche !"" en 2016 ?",Emmanuel Macron,Édouard Philippe,Manuel Valls,Jean Castex,1,Économie & Politique,macron,,,,,,
S,,"Quel homme politique français a fondé le ""Rassemblement pour la République"" (RPR) en 1976 ?",Jacques Chirac,Charles Pasqua,Édouard Balladur,Alain Juppé,2,Économie & Politique,chirac,,,,,,
S,,"Quel homme politique français a fondé le ""Mouvement Démocrate"" (MoDem) en 2007 ?",François Bayrou,Jean-Louis Borloo,Dominique de Villepin,Manuel Valls,2,Économie & Politique,bayrou,,,,,,
S,,Quel élevage porte le nom de cuniculiculture ?,Les lapins,Les huîtres,Les vers à soie,Les chauves-souris,3,Sciences de la vie,lapin,,,,,,
S,,"Quelle partie de l’animal désigne-t-on par le terme culinaire ""rognons"" ?",Les reins,Les testicules,Le foie,La cervelle,3,Gastronomie,rein,,,,,,
S,,Quel artiste a vu l'une de ses chansons partir dans l’espace à bord des sondes Voyager en 1977 ?,Chuck Berry,Louis Armstrong,Bob Dylan,The Beatles,3,Musique,berry | charles edward anderson berry,,,,,,
S,,"Quel ordre militaire protège le Mur dans la série ""Game of Thrones"" ?",La Garde de Nuit,Les Lames Noires,Les Veilleurs du Nord,Les Frères de l'Hiver,2,Cinéma & Séries,night's watch,,,,,,
S,,"Comment se nomme la capitale des Sept Couronnes dans la série ""Game of Thrones"" ?",Port-Réal,Harrenhal,Peyredragon,Hautjardin,2,Cinéma & Séries,king's landing,,,,,,
S,,"Quelle maison porte pour emblème un cerf couronné sur fond doré dans la série ""Game of Thrones"" ?",Baratheon,Tyrell,Martell,Arryn,2,Cinéma & Séries,-,,,,,,
S,,"Quel métal fictif peut tuer les Marcheurs Blancs dans la série ""Game of Thrones"" ?",L'acier valyrien,L'or-dragon,Le fer d'Asshaï,Le sang d'obsidienne,3,Cinéma & Séries,valyrian steel,,,,,,
S,,"Quel est le nom du continent principal où se déroule l’intrigue de la série ""Game of Thrones"" ?",Westeros,Sothoryos,Andalos,Valyria,2,Cinéma & Séries,-,,,,,,
S,,Quel tueur en série a terrorisé le quartier de Whitechapel à Londres en 1888 ?,Jack l'Éventreur,Zodiac,H.H. Holmes,Ted Bundy,2,Histoire,jack the ripper,,,,,,
S,,Quel service de cloud est reconnaissable à son logo en forme de boîte bleue ouverte ?,Dropbox,Google Drive,OneDrive,Mega,1,Technologie,-,,,,,,
S,,Dans quel pays se situe la ville de Malmö ?,La Suède,Le Danemark,La Norvège,La Finlande,2,Géographie,-,,,,,,
S,,"Quelle épice surnomme-t-on ""l’or rouge"" ?",Le safran,Le curcuma,Le paprika,Le sumac,2,Gastronomie,-,,,,,,
S,,"Quelle enseigne de fast-food commercialise le sandwich ""Big Mac"" ?",McDonald's,Quick,Five Guys,Burger King,1,Économie & Politique,-,,,,,,
S,,"Quelle enseigne de fast-food a pour slogan emblématique ""Have it your way"" ?",Burger King,Subway,McDonald's,Taco Bell,2,Économie & Politique,-,,,,,,
S,,"Quelle enseigne de fast-food a été popularisée par ses ""11 herbes et épices secrètes"" ?",KFC,Popeyes,Chick-fil-A,Texas Chicken,2,Économie & Politique,kentucky fried chicken,,,,,,
S,,Quelle enseigne de fast-food utilise un clown nommé Ronald comme emblème publicitaire ?,McDonald's,Burger King,KFC,Subway,1,Économie & Politique,-,,,,,,
S,,Quel savant est célèbre pour avoir déchiffré les hiéroglyphes grâce à la pierre de Rosette ?,Jean-François Champollion,Howard Carter,Hérodote,Rosalind Franklin,3,Histoire,champollion,,,,,,
S,,Quelle fine pellicule mate et poudreuse recouvre naturellement la peau des raisins ?,La pruine,La sporée,L'arille,La ziste,4,Sciences de la vie,-,,,,,,
S,,Quel poisson marin au corps serpentiforme et aux puissantes mâchoires vit dans les anfractuosités rocheuses ?,La murène,L'anguille,Le barracuda,La rascasse,3,Sciences de la vie,murenes | murenides,,,,,,
S,,Quel est le nom du vaste complexe impérial situé au cœur de Pékin et fermé au public jusqu'au XXe siècle ?,La Cité interdite,Le temple du Ciel,Le palais d'Été,Le palais de Mukden,3,Histoire,-,,,,,,
S,,Quel mammifère carnivore est naturellement immunisé contre certains venins de serpent ?,La mangouste,Le suricate,La civette,La genette,3,Sciences de la vie,herpestides,,,,,,
S,,Quel traité de 1555 a mis temporairement fin aux guerres de religion dans le Saint-Empire romain germanique ?,La paix d’Augsbourg,La paix de Westphalie,La paix de Ryswick,La paix de Nimègue,4,Histoire,-,,,,,,
S,,Quel événement a entraîné l’abdication de Charles X à la suite d’un soulèvement populaire en 1830 ?,Les Trois Glorieuses,Les Cent-Jours,La Semaine sanglante,La Nuit du 4 août,3,Histoire,revolution de juillet | revolution de 1830 | 3 glorieuses,,,,,,
S,,"Quel dieu romain à deux visages opposés est associé aux portes, aux choix et aux passages ?",Janus,Portunus,Bacchus,Faunus,3,Croyances,-,,,,,,
