id,img,question,A,B,C,D,difficulte,theme,fuzzy,frequence,exact,,,,,
3GF3,,"Quelle grotte préhistorique, découverte en 1940 en Dordogne, est mondialement célèbre pour ses peintures rupestres vieilles d’environ 17 000 ans ?",La grotte de Lascaux,La grotte Chauvet,La grotte de Cosquer,La grotte de Rouffignac,2,Histoire,lascaux,,,,,,,
JWV0,,De quel pays la poutine est-elle un plat emblématique ?,Le Canada,La Belgique,La Suisse,Le Royaume-Uni,1,Gastronomie,-,,,,,,,
ADCH,,"Quel est le nom officiel de l’Irlande dans sa langue nationale, le gaélique irlandais ?",Éire,Gaeltacht,Albion,Celtia,3,Géographie,-,,,,,,,
Y7DS,,"Complétez ce titre d'une chanson d'Henri Salvador : ""Le travail, c'est...""",La santé,L'avenir,Fini,Dur,3,Musique,-,,,,,,,
ZOM6,,Quelle planète du Système solaire possède le plus grand nombre de satellites naturels connus ?,Saturne,Jupiter,Mars,Mercure,3,Science,-,,,,,,,
CALN,,"Quel est le nom du pain elfique dans l'univers du ""Seigneur des Anneaux"" ?",Le lembas,Le miruvor,Le cram,Le mallorn,3,Audiovisuel,-,,,,,,,
X9BC,,"Quel est le prénom de l’héroïne connue sous le nom de ""Wonder Woman"" dans l’univers de DC Comics ?",Diana,Selena,Victoria,Cassandra,3,Pop culture,diana prince,,,,,,,
N597,,"Quelle tour du 15ème arrondissement parisien était, lors de son inauguration en 1973, le plus haut gratte-ciel d'Europe ?",La tour Montparnasse,La tour Saint-Jacques,La tour First,La tour Pleyel,2,Géographie,montparnasse | maine-montparnasse | tour maine-montparnasse,,,,,,,
R1QG,,Quel est le nom du restaurant panoramique situé au 56ème étage de la tour Montparnasse à Paris ?,Le Ciel de Paris,Le Jules Verne,Les Ombres,Le Georges,3,Gastronomie,-,,,,,,,
ULXC,472,"Dans quelle ville allemande se situe la tour Messeturm, aussi surnommée ""le crayon"" en raison de sa forme élancée ?",Francfort-sur-le-Main,Düsseldorf,Hambourg,Cologne,3,Géographie,francfort,,,,,,,
9YTC,,Quel fleuve traverse la ville de Paris ?,La Seine,La Marne,La Loire,Le Rhône,1,Géographie,-,,,,,,,
BCF1,,"Quel cinéaste britannique, surnommé ""le maître du suspense"", a réalisé les films ""Psychose"", ""Sueurs froides"" et ""Les Oiseaux"" ?",Alfred Hitchcock,Orson Welles,Stanley Kubrick,David Lynch,2,Audiovisuel,hitchcock,,,,,,,
Z38A,,Quel est le nom du fidèle compagnon et narrateur des enquêtes du détective Sherlock Holmes ?,Le docteur Watson,L'inspecteur Lestrade,Le professeur Moriarty,Le colonel Moran,2,Littérature,watson | john watson | docteur john watson | dr watson | dr john watson,,,,,,,
0L3S,,"Quel personnage féminin, créé par Arthur Conan Doyle dans la nouvelle ""Un scandale en Bohême"", parvient à déjouer Sherlock Holmes par sa ruse et son intelligence ?",Irene Adler,Mary Morstan,Violet Hunter,Adèle Fortescue,3,Littérature,adler,,,,,,,
WO84,473,"Quel est le nom de cet artiste espagnol du XXe siècle, figure emblématique du surréalisme ?",Salvador Dalí,Pablo Picasso,Joan Miró,René Magritte,1,Arts,dali,,,,,,,
2VWC,,Dans quel pays se trouve le volcan Eyjafjallajökull qui a paralysé le trafic aérien européen en 2010 ?,L'Islande,La Norvège,Le Danemark,La Finlande,2,Société,-,,,,,,,
X5AO,,Quel pays des Caraïbes a été frappé en janvier 2010 par un violent séisme ayant fait plus de 200 000 morts ?,Haïti,La Jamaïque,Trinité-et-Tobago,Les Philippines,2,Société,-,,,,,,,
XX77,,"Complétez cette expression : ""Avec des si, on mettrait Paris en...""",Bouteille,Feu,Chanson,Morceaux,2,Littérature,-,,,,,,,
OQ0B,,Quelle préfecture japonaise a été gravement touchée en 2011 par un accident nucléaire à la suite d’un séisme et d’un tsunami ?,Fukushima,Ibaraki,Aomori,Niigata,2,Société,-,,,,,,,
XOAK,,Comment s’appelaient les danseuses qui accompagnaient Claude François sur scène et à la télévision ?,Les Claudettes,Les Claudines,Les Claudiennes,Les Claudinettes,1,Audiovisuel,clodettes,,,,,,,
TSBJ,,Quel jeu d’adresse consiste à retirer délicatement des baguettes entremêlées sans faire bouger les autres ?,Le mikado,Le Jenga,Le Kapla,Le domino,2,Pop culture,pick-up sticks,,,,,,,
2KTP,,"Quel animal appelait-on autrefois ""goupil"" ?",Le renard,Le cerf,La souris,Le lapin,2,Nature,-,,,,,,,
6W1U,,"Au tarot, combien de points faut-il au preneur pour gagner une partie lorsqu’il possède trois bouts ?",36 points,41 points,51 points,56 points,3,Pop culture,36 | trente six | trente six points | 36 pts,,,,,,,
S514,,"Combien de cartes spéciales appelées ""bouts"" y a-t-il dans le jeu de tarot ?",3,0,5,7,3,Pop culture,trois | 3 bouts | trois bouts,,,,,,,
ORST,,Combien de cartes compte un jeu de tarot complet ?,78 cartes,52 cartes,32 cartes,58 cartes,3,Pop culture,78 | soixante dix huit,,,,,,,
Y4ZK,,"Complétez ce titre d'une fable de Jean de La Fontaine : ""La Cigale et...""",La Fourmi,Le Corbeau,La Grenouille,Le Rat,1,Littérature,-,,,,,,,
PMGY,,"Complétez cette expression : ""Qui vole un œuf vole...""",Un bœuf,Un cochon,Une poule,Un mouton,1,Littérature,boeuf,,,,,,,
Z32T,,De quelle couleur devient la peau de Bruce Banner lorsqu'il se transforme en Hulk ?,Vert,Bleu,Noir,Rouge,1,Pop culture,verte,,,,,,,
9CMX,,"Comment se prénomme le fils d’Anakin Skywalker dans la saga ""Star Wars"" ?",Luke,Obi-Wan,Han,Kylo,1,Audiovisuel,luke skywalker,,,,,,,
6Y1W,,"Dans quel pays utilise-t-on le mot ""cosmonaute"" pour désigner les voyageurs de l’espace ?",La Russie,Les États-Unis,La Chine,La France,2,Science,urss,,,,,,,
8R3V,,"Quel animal peut être ""empereur"", ""Adélie"" ou ""papou"" ?",Le manchot,Le scorpion,Le poulpe,Le rhinocéros,2,Nature,-,,,,,,,
0XV6,,"Quel animal peut être ""marteau"", ""citron"" ou ""pèlerin"" ?",Le requin,Le dauphin,La baleine,L'orque,1,Nature,-,,,,,,,
H9MB,,"Combien de mineurs sont restés piégés à près de 700 mètres de profondeur lors de l’accident de la mine de San José, au Chili, en 2010 ?",33,12,51,74,4,Société,trente trois | 33 mineurs,,,,,,,
GMXZ,,Dans quelle mine chilienne 33 mineurs sont-ils restés bloqués sous terre pendant plus de deux mois en 2010 ?,La mine de San José,La mine d’Escondida,La mine de Chuquicamata,La mine de Copiapó,3,Société,san jose,,,,,,,
HMFZ,,"De quel pays provenait l’avion présidentiel qui s’est écrasé en 2010 près de Smolensk, en Russie ?",La Pologne,La Hongrie,L'Ukraine,La République tchèque,2,Société,polonais,,,,,,,
WZJ3,,"Quel site web, fondé en 2006 par Julian Assange, est spécialisé dans la diffusion de documents confidentiels ?",WikiLeaks,Anonymous,The Intercept,Panama Papers,2,Société,-,,,,,,,
7ME1,,"Quel informaticien et journaliste australien, fondateur du site WikiLeaks, s'est fait connaître en 2010 après la diffusion de documents confidentiels américains ?",Julian Assange,Edward Snowden,Aaron Swartz,Glenn Greenwald,2,Société,assange | julian paul hawkins,,,,,,,
0LAU,,Quelle analyste militaire américaine a transmis en 2010 à WikiLeaks des milliers de documents confidentiels sur les guerres d’Irak et d’Afghanistan ?,Chelsea Manning,Reality Winner,Katharine Gun,Frances Haugen,3,Société,manning | bradley manning,,,,,,,
Y04B,,"Quel homme politique français, ancien directeur général du FMI, a été impliqué dans l'affaire du ""Sofitel"" de New York en 2011 ?",Dominique Strauss-Kahn,François Hollande,Pierre Moscovici,Michel Sapin,2,Société,dsk | strauss-kahn,,,,,,,
FKZD,,Quelle spécialité bretonne est traditionnellement préparée sur un billig ?,La crêpe,Le kouign-amann,Le far breton,Le craquelin,2,Gastronomie,galette | crepes | galettes,,,,,,,
UTR0,,"Quel est le nom du spécialiste du café travaillant dans les bars, hôtels ou coffee shops ?",Un barista,Un sommelier,Un mixologue,Un torréfacteur,2,Gastronomie,bariste,,,,,,,
W64Y,,Quel professionnel de la restauration est spécialisé dans la préparation et la création de cocktails ?,Le mixologue,L'œnologue,Le barista,Le sommelier,2,Gastronomie,mixologiste,,,,,,,
OKU6,,"Quel professionnel est chargé de sélectionner, conserver et servir les vins dans un restaurant gastronomique ?",Le sommelier,L’œnologue,Le caviste,Le mixologue,2,Gastronomie,-,,,,,,,
8UZE,,Quel est le nom du commerçant spécialisé dans la vente de vin et de spiritueux ?,Le caviste,Le sommelier,L’œnologue,Le viticulteur,2,Gastronomie,-,,,,,,,
G9BG,,"Quel spécialiste du vin accompagne le vigneron dans la vinification, l’assemblage et le contrôle de la qualité des vins ?",L’œnologue,Le sommelier,Le négociant,Le maître de chai,2,Gastronomie,oenologue,,,,,,,
FRRR,,"Dans un domaine viticole, quel professionnel supervise la vinification, le vieillissement et la mise en bouteille, en collaboration avec l’œnologue ?",Le maître de chai,Le sommelier,Le caviste,Le viticulteur,3,Gastronomie,-,,,,,,,
6WY1,,Quel professionnel se focalise sur la culture de la vigne et la production de raisin destiné à la fabrication du vin ?,Le viticulteur,Le vigneron,Le maître de chai,Le caviste,2,Nature,-,,,,,,,
ANT4,,Quel terme désigne les bulles de texte utilisées dans les bandes dessinées pour contenir les paroles ou les pensées des personnages ?,Le phylactère,La cartouche,L'encadré,L'appendice,3,Pop culture,phylacteres,,,,,,,
J3PM,,"Quel terme latin désigne l'erreur de langage involontaire commise en remplaçant un mot par un autre, révélant souvent une pensée inconsciente ?",Le lapsus,Le distinguo,Le quiproquo,L'erratum,2,Littérature,-,,,,,,,
8277,,"Combien de mois du calendrier grégorien contiennent la lettre ""A"" dans leur nom ?",5,4,6,7,2,Divers,cinq,,,,,,,
H51P,,Quel animal est traditionnellement associé au problème fondateur qui illustre la suite de Fibonacci ?,Le lapin,La poule,La souris,La grenouille,2,Science,lapins,,,,,,,
SBHS,,Quel adjectif qualifie une sole que l'on a poêlée au beurre après l'avoir farinée ?,Meunière,Forestière,Marinière,Bistrotière,2,Gastronomie,sole meunière,,,,,,,
CIG7,,De quelle couleur est le timbre Marianne utilisé pour affranchir une lettre internationale depuis la France ?,Violet,Vert,Rouge,Gris,3,Divers,violette | mauve,,,,,,,
R065,,Quelle branche de l’anatomie s’intéresse à l’étude des muscles ?,La myologie,La kinésiologie,La physiologie,La morphologie,2,Nature,-,,,,,,,
SL0B,,Quel muscle du corps humain peut être fémoral ou brachial ?,Le biceps,Le quadriceps,Le deltoïde,Le trapèze,2,Nature,-,,,,,,,
R38W,,"Quel carburant, obtenu par distillation du pétrole brut, sert à alimenter les turbines à réaction des avions ?",Le kérosène,L'essence,Le fioul,L'éthanol,2,Science,petrole lampant,,,,,,,
HOAH,,Quel trouble mental est caractérisé par une méfiance extrême et des idées délirantes de persécution ou de complot ?,La paranoïa,La schizophrénie,L'hypocondrie,La phobie sociale,2,Nature,-,,,,,,,
04QF,,"Quelle principauté commémore chaque 19 novembre la ""Fête du Prince"", journée nationale en l'honneur du souverain régnant ?",Monaco,Le Liechtenstein,Andorre,Malte,2,Société,principaute de monaco,,,,,,,
N1BU,,"Quel apôtre du Christ est considéré comme le saint patron de l’Écosse, célébré chaque 30 novembre lors de la fête nationale ?",Saint André,Saint Patrick,Saint George,Saint David,2,Croyances,andre | andrew | saint andrew,,,,,,,
QPQL,,"Quel pays célèbre sa fête nationale le 12 octobre, en commémoration de l’arrivée de Christophe Colomb en Amérique ?",L'Espagne,L'Argentine,Le Guatemala,L'Italie,3,Géographie,-,,,,,,,
3AKG,,De quel pays était originaire le navigateur Christophe Colomb ?,L'Italie,L'Espagne,La France,Le Portugal,2,Histoire,-,,,,,,,
YJC1,,Quel explorateur est traditionnellement crédité de la découverte de l’Amérique en 1492 ?,Christophe Colomb,Amerigo Vespucci,Fernand de Magellan,Vasco de Gama,1,Histoire,colomb | cristoffa combo | cristoforo colombo | cristóbal colón | combo | colombo | colon,,,,,,,
4UAL,474,"Quelle chanteuse est la voix française de la princesse Sélénia dans la saga ""Arthur et les Minimoys"" ?",Mylène Farmer,Vanessa Paradis,Carla Bruni,Zazie,3,Audiovisuel,farmer,,,,,,,
TZ7N,475,"Quel comédien est la voix française du mammouth Manny dans la saga ""L'Âge de glace"" ?",Gérard Lanvin,Jean Reno,Gérard Darmon,François Cluzet,3,Audiovisuel,lanvin,,,,,,,
2EN5,476,"Quel comédien est la voix française du paresseux Sid dans la saga ""L'Âge de glace"" ?",Élie Semoun,Dany Boon,Gad Elmaleh,Patrick Timsit,2,Audiovisuel,semoun,,,,,,,
FDZW,477,"Quel comédien est la voix française du tigre Diego dans la saga ""L'Âge de glace"" ?",Vincent Cassel,Clovis Cornillac,Jean Dujardin,Patrick Bruel,3,Audiovisuel,cassel,,,,,,,
AXCK,478,"Quel comédien est la voix française du panda Po dans la saga ""Kung Fu Panda"" ?",Manu Payet,Kad Merad,Kev Adams,François-Xavier Demaison,3,Audiovisuel,payet,,,,,,,
V1O9,479,"Quel comédien est la voix française du poisson-clown Marin dans le film d'animation ""Le Monde de Nemo"" ?",Franck Dubosc,Kad Merad,Clovis Cornillac,Dany Boon,3,Audiovisuel,dubosc,,,,,,,
BMPP,480,"Quel comédien est la voix française du lion Mufasa dans le film d'animation ""Le Roi lion"" (1994) ?",Jean Reno,Gérard Darmon,Philippe Noiret,André Dussollier,3,Audiovisuel,reno,,,,,,,
H42L,,"Quel jeu d’adresse, populaire dans les cafés et les bars, consiste à renvoyer une bille métallique à l’aide de leviers pour éviter qu’elle ne tombe entre les trous ?",Le flipper,Le baby-foot,Le billard,Le air hockey,1,Pop culture,flippeur | billard electrique | machine a boules | pinball,,,,,,,
FFZD,,Quel liquide biologique facilite la digestion et l’élocution en maintenant la bouche humide ?,La salive,La sueur,Le suc gastrique,Le plasma,1,Nature,-,,,,,,,
PW6K,,Quel chef gaulois a uni plusieurs tribus pour résister à Jules César et fut vaincu à la bataille d’Alésia en 52 av. J.-C. ?,Vercingétorix,Brennus,Ambiorix,Clovis,2,Histoire,-,,,,,,,
SPLE,,"Quel ouvrage en sept livres, rédigé à la troisième personne par Jules César, relate sa conquête de la Gaule entre 58 et 51 avant J.-C. ?",La Guerre des Gaules,Les Mémoires de César,Les Conquêtes du Nord,Le Triomphe romain,3,Histoire,commentaires sur la guerre des gaules | bellum gallicum | de bello gallico | commentarii de bello gallico,,,,,,,
48AU,,Quelle bataille de 52 av. J.-C. vit la victoire de Vercingétorix sur les troupes de Jules César en Gaule ?,Gergovie,Alésia,Bibracte,Uxellodunum,2,Histoire,bataille de gergovie,,,,,,,
RATN,,"Lors de quelle bataille de 52 av. J.-C., Vercingétorix fut-il vaincu et capturé par les armées de Jules César, marquant la fin de la résistance gauloise ?",Alésia,Avaricum,Gergovie,Bibracte,2,Histoire,bataille d'alesia,,,,,,,
6TMJ,,Quel peuple celte fut vaincu par Jules César lors de la bataille de Bibracte en 58 av. J.-C ?,Les Helvètes,Les Arvernes,Les Éduens,Les Bituriges,3,Histoire,helvete,,,,,,,
MIOS,,"Quelle bataille de 58 av. J.-C., au début de la guerre des Gaules, vit Jules César vaincre le peuple des Helvètes ?",Bibracte,Alésia,Gergovie,Avaricum,3,Histoire,bataille de bibracte,,,,,,,
1EKI,,"Quel peuple gaulois, dont la capitale était Bibracte, soutint Jules César lors de la campagne contre les Helvètes en 58 av. J.-C. ?",Les Éduens,Les Arvernes,Les Carnutes,Les Séquanes,3,Histoire,héduens,,,,,,,
AB1Q,,"Quel titre portait le magistrat suprême du peuple gaulois des Éduens, chargé du pouvoir civil, militaire et judiciaire ?",Le vergobret,Le vates,Le taniste,Le nemeton,4,Histoire,vergobretus,,,,,,,
5U20,,"Quel druide gaulois, allié de Jules César, représenta le peuple des Éduens au Sénat romain avant la guerre des Gaules ?",Diviciacos,Dumnorix,Eporédorix,Sedullos,4,Histoire,diviciacus,,,,,,,
V0Y6,481,"Quelle figure historique est représentée par cette œuvre d'Aimé Millet, érigée à Alise-Sainte-Reine ?",Vercingétorix,Clovis,Charlemagne,Brennus,2,Histoire,-,,,,,,,
ARYF,,Quel monolithe de pierre dressé verticalement est souvent associé à la commune de Carnac et au personnage d'Obélix ?,Le menhir,Le dolmen,L'obélisque,Le cairn,2,Nature,-,,,,,,,
DQZ2,482,"Quel est le nom de ce personnage de la bande dessinée ""Astérix et Obélix"" ?",Jules César,Caius Bonus,Brutus,Pompée,1,Pop culture,cesar,,,,,,,
4BQF,,"Quelle extension du jeu ""World of Warcraft"", sortie en 2008, permet au joueur de voyager dans les régions glacées de Norfendre ?",Wrath of the Lich King,Cataclysm,Mists of Pandaria,Legion,3,Pop culture,wotlk,,,,,,,
PWHZ,,"Qui est l'antagoniste principal du jeu ""The Elder Scrolls IV: Oblivion"", un prince daedra qui tente d'ouvrir les portes d'Oblivion ?",Mehrunes Dagon,Sheogorath,Hermaeus Mora,Meridia,3,Pop culture,dagon,,,,,,,
3MH4,,"De quelle chanson folklorique russe traditionnelle est inspiré le thème principal du jeu ""Tetris"" ?",Korobeïniki,Kalinka,Barynya,Troïka,3,Pop culture,-,,,,,,,
Q47M,,"Quel jeu vidéo de réflexion, créé en 1984 par Alekseï Pajitnov, consiste à empiler des briques pour compléter des lignes ?",Tetris,Puyo Puyo,Lemmings,Dr. Mario,1,Pop culture,-,,,,,,,
G12F,,"Aux échecs, quelle ouverture débute par les coups ""1.e4 c5"" ?",La défense sicilienne,La défense Caro-Kann,La défense française,La défense scandinave,3,Pop culture,sicilienne,,,,,,,
M85K,,"Aux échecs, combien de cases un cavalier peut-il atteindre au maximum ?",8,4,6,10,2,Pop culture,huit | 8 cases | huit cases,,,,,,,
A9ZR,,"Qui est le chanteur du groupe de heavy metal ""Iron Maiden"" ?",Bruce Dickinson,James Hetfield,Ozzy Osbourne,Rob Halford,3,Musique,dickinson,,,,,,,
OS59,,Quel scientifique d’origine écossaise est crédité de l'invention du téléphone en 1876 ?,Alexander Graham Bell,Thomas Edison,Nikola Tesla,James Watt,2,Science,bell,,,,,,,
SWGJ,,"Quel empereur a légalisé le christianisme dans l’Empire romain en publiant ""l'Édit de Milan"" en 313 ?",Constantin Ier,Néron,Théodose Ier,Dioclétien,3,Croyances,constantin i | constantin premier | constantinus,,,,,,,
RFNY,,Quel maréchal britannique remporta la bataille d’El-Alamein en 1942 face aux forces de Rommel durant la Seconde Guerre mondiale ?,Bernard Law Montgomery,Andrew Cunningham,Harold Alexander,Archibald Wavell,2,Histoire,montgomery,,,,,,,
4FT3,,"Quel Premier ministre japonais annonça la capitulation du Japon en août 1945, marquant ainsi la fin de la Seconde Guerre mondiale ?",Kantarō Suzuki,Hirohito,Isoroku Yamamoto,Hideki Tōjō,3,Histoire,suzuki,,,,,,,
OEL8,,"Quel est le nom du premier sous-marin nucléaire de l’histoire, lancé par la marine américaine en 1954 ?",L’USS Nautilus,L'USS Enterprise,L'USS Arizona,L'USS Missouri,2,Histoire,nautilus | USS Nautilus SSN-571,,,,,,,
R0QU,,Quel programme de recherche américain mena à la création de la première bombe atomique pendant la Seconde Guerre mondiale ?,Le projet Manhattan,Le projet Apollo,Le projet Mercury,Le projet Nova,2,Histoire,-,,,,,,,
FMCD,,"Quel nom de code, inspiré d’un poème de John Donne, désigne le premier essai nucléaire effectué dans le désert du Nouveau-Mexique en juillet 1945 ?",Trinity,Manhattan,Valediction,Omega,2,Histoire,test trinity,,,,,,,
9B48,,"Quel roi des Francs, fils de Pépin le Bref, est devenu empereur d'Occident en l'an 800, marquant la naissance de l'Empire carolingien ?",Charlemagne,Clovis Ier,Louis XIV,Philippe Auguste,1,Histoire,charles 1er | charles premier | charles i | carolus magnus | charles le grand,,,,,,,
BP6D,,"Quel est l'organe principal du système respiratoire, chargé d’assurer l'échange d'oxygène et de dioxyde de carbone entre l'air inspiré et le sang ?",Les poumons,Le cœur,Les reins,Le foie,1,Nature,poumon,,,,,,,
MVOG,,"Dans le jeu ""World of Warcraft"", quelle est la capitale humaine du royaume d'Azeroth, située dans la région d'Elwynn ?",Hurlevent,Forgefer,Darnassus,Exodar,2,Pop culture,stormwind,,,,,,,
VMKF,,Quel est le nom donné à l'hybride né de l'union d'un lion mâle et d'une tigresse femelle ?,Le ligre,Le tigron,Le léopon,Le tigard,3,Nature,-,,,,,,,
0ZAN,,"Quelle formule latine associée au philosophe René Descartes signifie ""Je pense, donc je suis"" ?","Cogito, ergo sum",Carpe diem,"Veni, vidi, vici",E pluribus unum,2,Littérature,cogito ergo sum,,,,,,,
GRGN,,"Quel criminel français du XXe siècle, surnommé ""l'ennemi public n°1"", mena une vie de cavale spectaculaire avant d'être abattu par la police en 1979 ?",Jacques Mesrine,Albert Spaggiari,François Besse,Patrick Henry,2,Société,mesrine,,,,,,,
6DAZ,,"Quel est le principal gaz composant l'atmosphère terrestre, représentant environ 78 % de son volume ?",L'azote,L'oxygène,Le dioxyde de carbone,L'argon,2,Science,diazote | N | N2,,,,,,,
RFB4,,Quel fleuve traverse la ville de Londres ?,La Tamise,La Severn,La Mersey,La Trent,1,Géographie,thames,,,,,,,
JQ7N,,Quel est le plus long fleuve du Royaume-Uni ?,La Severn,La Tamise,La Clyde,La Mersey,2,Géographie,saverne | sabrine,,,,,,,
PT87,,"Quel fleuve britannique, long d'environ 110 kilomètres, traverse la ville de Liverpool avant de se jeter dans la mer d'Irlande ?",La Mersey,La Tyne,La Tamise,La Trent,3,Géographie,-,,,,,,,
WBFF,,Quel culturiste et acteur d'origine autrichienne fut gouverneur de l'État de Californie de 2003 à 2011 ?,Arnold Schwarzenegger,Sylvester Stallone,Clint Eastwood,Dolph Lundgren,2,Société,schwarzenegger | schwarzy,,,,,,,
WI99,,Quel nom allemand désigne l'annexion de l'Autriche par l'Allemagne nazie en mars 1938 ?,L'Anschluss,Le Lebensraum,L'Heimkehr,L'Einheit,3,Histoire,anschluß,,,,,,,
L7Z1,,"Quel chancelier autrichien fut contraint de démissionner en mars 1938 sous la pression d’Hitler, ouvrant la voie à l'Anschluss ?",Kurt Schuschnigg,Engelbert Dollfuss,Arthur Seyss-Inquart,Kurt von Schleicher,4,Histoire,schuschnigg,,,,,,,
7WHS,,"Quel entraîneur écossais a dirigé le club de football de Manchester United de 1986 à 2013, remportant plus de 30 trophées ?",Alex Ferguson,Arsène Wenger,Kenny Dalglish,Matt Busby,2,Sport,ferguson | sir alex ferguson | alexander chapman ferguson | alexander ferguson,,,,,,,
VIN2,,Dans quelle ville est né le compositeur Wolfgang Amadeus Mozart en 1756 ?,Salzbourg,Munich,Prague,Vienne,2,Arts,salzburg,,,,,,,
1AZM,,"Quelle île française de la mer Méditerranée est surnommée ""l'île de Beauté"" ?",La Corse,La Sardaigne,La Crète,L'île d'Oléron,1,Géographie,-,,,,,,,
730L,,"Quel est le plus vaste océan de la planète Terre, couvrant près de 46% de la surface des eaux mondiales ?",L'océan Pacifique,L'océan Atlantique,L'océan Indien,L'océan Austral,1,Géographie,pacifique,,,,,,,
D4T4,,"Quel animal peut être ""à bosse"", ""bleue"" ou ""franche"" ?",La baleine,La tortue,La crevette,La pieuvre,1,Nature,baleines,,,,,,,
QSWE,,Quel est le nom des structures cornées que possèdent certaines baleines pour filtrer le plancton dans l’eau ?,Les fanons,Les barbillons,Les palatines,Les plicules,3,Nature,fanon,,,,,,,
PYDN,,"Quel animal peut être ""hulotte"", ""harfang"" ou ""à lunettes"" ?",La chouette,Le paon,La panthère,Le renard,2,Nature,chouettes,,,,,,,
DW4C,,"Quel animal peut être ""du Nil"", ""marin"" ou ""des marais"" ?",Le crocodile,L'hippopotame,La vipère,Le crabe,2,Nature,crocodiles,,,,,,,
HOM8,,"Quel pays a été marqué en 2004 par la ""Révolution orange"", un vaste soulèvement populaire contre la fraude électorale ?",L'Ukraine,La Serbie,La Pologne,La Géorgie,3,Société,-,,,,,,,
WXZV,,De quelle maison de haute couture John Galliano était-il le directeur artistique avant son renvoi en 2011 ?,Dior,Givenchy,Michael Kors,Louis Vuitton,2,Arts,-,,,,,,,
AP6M,,"Quelle icône de la pop mondiale incarne Eva Perón dans le film ""Evita"" (1996) ?",Madonna,Cher,Barbra Streisand,Tina Turner,2,Audiovisuel,ciccone | madonna louise ciccone,,,,,,,
NDR1,,"Quel mangaka japonais a créé le manga ""Dragon Ball"" ?",Akira Toriyama,Eiichiro Oda,Masashi Kishimoto,Yoshihiro Togashi,2,Pop culture,toriyama,,,,,,,
EF2F,,"Dans quel océan se situe la région surnommée le ""triangle des Bermudes"" ?",L'océan Atlantique,L'océan Pacifique,L'océan Indien,L'océan Arctique,1,Géographie,atlantique,,,,,,,
3ZIG,,Quel alcool est utilisé comme ingrédient principal dans la préparation d'un mojito ?,Le rhum,La tequila,La vodka,Le gin,2,Gastronomie,rhum blanc | rhum brun,,,,,,,
OYO4,,En quelle année l’homme a-t-il marché pour la première fois sur la Lune ?,1969,1965,1967,1971,2,Société,-,,,,,,,
87MT,,De quel pays est originaire le peintre Vincent van Gogh ?,Les Pays-Bas,La Pologne,La France,La Belgique,1,Arts,hollande,,,,,,,
DLUO,,"Dans quel sport est décernée chaque année la ""Coupe Stanley"" ?",Le hockey sur glace,Le water-polo,La boxe anglaise,Le tennis,2,Sport,hockey,,,,,,,
X9EH,,Quelle est la monnaie officielle du Japon ?,Le yen,Le won,Le yuan,Le dollar japonais,2,Société,yen japonais,,,,,,,
ER9O,,"Au bowling, combien de quilles faut-il faire tomber en un seul lancer pour réaliser un strike ?",10,9,11,12,2,Pop culture,dix | 10 quilles | dix quilles,,,,,,,
LN8G,,Combien de pattes possède une araignée ?,8,6,10,12,1,Nature,huit | 8 pattes | huit pattes,,,,,,,
7O7Z,,De quel pays est originaire le joueur de football Lionel Messi ?,L'Argentine,L'Espagne,Le Brésil,L'Italie,1,Sport,argentin,,,,,,,
QLP1,,"Dans la saga ""Harry Potter"", quel animal est représenté sur le blason de la maison Gryffondor ?",Un lion,Un loup,Un ours,Un aigle,2,Littérature,-,,,,,,,
M19F,,Quel est le nom de l’hymne national de l’Espagne ?,La Marcha Real,El Himno de Riego,El Canto de la Esperanza,Los Ecos Ibéricos,3,Géographie,la marcha granadera | la marche royale,,,,,,,
5XOR,,Combien de faces possède un cube ?,6,4,8,10,1,Science,six | 6 faces | six faces,,,,,,,
SHKL,,"Quel jeu de cartes à collectionner en ligne, conçu en 2014 par ""Blizzard Entertainment"", est inspiré de l'univers de ""Warcraft"" ?",Hearthstone,Legends of Runeterra,Magic,Gwent,2,Pop culture,-,,,,,,,
