type,img,question,A,B,C,D,difficulte,theme,fuzzy,exact,,,,,
S,,Quelle viande est traditionnellement servie lors de la fête de Thanksgiving aux États-Unis ?,La dinde,L'agneau,Le boeuf,Le canard,2,Gastronomie,-,,,,,,
S,,Quel pigeon voyageur a sauvé des soldats américains encerclés en 1918 ?,Cher Ami,Bel Amant,Bon Copain,Joli Coeur,4,Histoire,-,,,,,,
S,,Quel est le symbole chimique du mercure dans le tableau périodique des éléments ?,Hg,Me,Cn,Mc,3,Sciences exactes,-,1,,,,,
S,,"Quel scientifique est crédité de la découverte de plusieurs gaz nobles, dont le néon, le krypton et le xénon ?",William Ramsay,Antoine Lavoisier,Henry Cavendish,Joseph Priestley,4,Sciences exactes,ramsay,,,,,,
S,,"Sous quel pseudonyme l’auteur de la chasse au trésor ""La Chouette d’or"" a-t-il publié les énigmes en 1993 ?",Max Valentin,Jacques Lenoir,Michel Rossetti,Philippe Montfort,4,Jeux & BD,valentin,,,,,,
S,,Quel était le nom de la chienne envoyée dans l’espace par l’URSS en 1957 ?,Laïka,Belka,Mishka,Luna,3,Actualités & Médias,-,,,,,,
S,,"Quel sommet français est surnommé le ""Géant de Provence"" ?",Le mont Ventoux,La montagne Sainte-Victoire,Le mont Aigoual,Les Dentelles de Montmirail,3,Géographie,-,,,,,,
S,,Quel adjectif utilise-t-on pour désigner le sud ?,Méridional,Septentrional,Austral,Zénithal,2,Géographie,-,,,,,,
S,,Quel adjectif utilise-t-on pour désigner le nord ?,Septentrional,Méridional,Boréal,Polaire,2,Géographie,-,,,,,,
S,,"Quelle ville française est surnommée ""la ville rose"" ?",Toulouse,Lille,Reims,Avignon,1,Géographie,-,,,,,,
S,,Quel est le point culminant de la Belgique ?,Le signal de Botrange,Le mont Cassel,Le Grand Ballon,Le mont Kemmel,4,Géographie,-,,,,,,
S,,Quel est le plus haut sommet de France ?,Le mont Blanc,La barre des Écrins,Le pic du Midi d’Ossau,Le puy de Sancy,1,Géographie,-,,,,,,
S,,Quel pays est traversé par l’équateur et le méridien de Greenwich ?,Le Gabon,Le Mali,L'Ouganda,Le Sénégal,4,Géographie,-,,,,,,
S,,Quel est le plus long fleuve de France ?,La Loire,La Seine,Le Rhône,La Garonne,1,Géographie,-,,,,,,
S,,"Quelle ville française est surnommée ""la cité phocéenne"" ?",Marseille,Montpellier,Nice,Saint-Tropez,2,Géographie,-,,,,,,
S,,Quel est le chef-lieu des Alpes-Maritimes ?,Nice,Cannes,Antibes,Toulon,2,Géographie,-,,,,,,
S,,Quelle chaîne de montagnes forme une frontière naturelle entre l’Asie et l’Europe ?,L'Oural,Les Carpates,Le Caucase,L'Altaï,2,Géographie,-,,,,,,
S,,Quelle planète est la plus proche du Soleil ?,Mercure,Vénus,Jupiter,Mars,1,Sciences exactes,-,,,,,,
S,,"Quel acteur interprète le rôle du Père Noël dans le film ""Le Père Noël est une ordure"" (1982) ?",Gérard Jugnot,Christian Clavier,Michel Blanc,Thierry Lhermitte,2,Cinéma & Séries,jugnot,,,,,,
S,,"Quel savant grec est à l’origine de l’exclamation ""Eureka"" ?",Archimède,Pythagore,Euclide,Platon,2,Sciences exactes,archimede de syracuse,,,,,,
S,,Quel canal relie l’océan Atlantique à l’océan Pacifique ?,Le canal de Panama,Le canal de Suez,Le canal de Kiel,Le canal de Corinthe,2,Géographie,panama,,,,,,
S,,Quel homme politique français a créé le Puy du Fou en 1989 ?,Philippe de Villiers,Jean-Frédéric Poisson,Charles Millon,Paul-Marie Coûteaux,3,Économie & Politique,philippe le jolis de villiers de saintignon | de villiers,,,,,,
S,,Quel est le nom du quartier général du département de la Défense aux États-Unis ?,Le Pentagone,Fort Knox,Langley,Le Capitole,2,Économie & Politique,-,,,,,,
S,,"De quelle série télévisée la sitcom ""Young Sheldon"" est-elle un spin-off ?",The Big Bang Theory,Modern Family,How I Met Your Mother,Malcolm,2,Cinéma & Séries,big bang theory,,,,,,
S,,Dans quelle ville se trouve la célèbre plage de Copacabana ?,Rio de Janeiro,Buenos Aires,Los Angeles,Cancún,2,Géographie,-,,,,,,
S,,Quel fruit est utilisé dans la préparation d’une pizza hawaïenne ?,L'ananas,La mangue,La banane,La papaye,1,Gastronomie,-,,,,,,
S,,Quel arôme a été le premier à être synthétisé chimiquement ?,La vanille,La fraise,La menthe,Le citron,2,Sciences exactes,vanilline,,,,,,
S,,Quel prénom féminin est associé à une chanson de Roch Voisine sortie en 1989 ?,Hélène,Caroline,Lucie,Nathalie,2,Musique,-,,,,,,
S,,Au cours de quel mois célèbre-t-on la fête des Pères en France ?,Juin,Mars,Septembre,Novembre,1,Divers,-,,,,,,
S,,Dans quelle région française a eu lieu le Débarquement des Alliés en juin 1944 ?,La Normandie,La Bretagne,Le Nord-Pas-de-Calais,Le Pays de la Loire,1,Histoire,-,,,,,,
S,,Quel surnom est associé au roi de France Louis VI ?,Le Gros,Le Juste,Le Hutin,Le Bel,4,Histoire,-,,,,,,
S,,Quel périphérique informatique permet de déplacer le curseur sur un écran d’ordinateur ?,La souris,Le clavier,Le scanner,Le disque dur,1,Technologie,-,,,,,,
S,,Quelle ville française est célèbre pour sa production de pruneaux ?,Agen,Reims,Nîmes,Carcassonne,1,Géographie,-,,,,,,
S,,Dans quel jeu de société est-il possible d’effectuer un roque ?,Les échecs,Le backgammon,Le shōgi,Les dames,2,Jeux & BD,-,,,,,,
S,,Quelle est l’avenue emblématique du théâtre à New York ?,Broadway,Fifth Avenue,Madison Avenue,Wall Street,2,Arts & Culture,-,,,,,,
S,,À quel joueur Zidane a-t-il donné un coup de tête en finale de la Coupe du monde 2006 ?,Marco Materazzi,Fabio Cannavaro,Paolo Maldini,Gennaro Gattuso,2,Sport,materazzi,,,,,,
S,,Quel est le pays d’origine du peuple Maori ?,La Nouvelle-Zélande,Hawaï,L'Australie,La Papouasie-Nouvelle-Guinée,2,Géographie,-,,,,,,
S,,Quel est le nom du liquide qui entoure le fœtus pendant la grossesse ?,Le liquide amniotique,Le liquide céphalo-rachidien,Le liquide synovial,Le liquide péritonéal,2,Sciences de la vie,amniotique,,,,,,
S,,Quelle est la couleur du permis de conduire français ?,Rose,Jaune,Gris,Vert,1,Divers,-,,,,,,
S,,Quel personnage mythologique fait traverser le Styx aux âmes des morts ?,Charon,Achéron,Thanatos,Hadès,3,Croyances,-,,,,,,
S,,Quel dictateur a dirigé le Chili après le coup d’État de 1973 ?,Augusto Pinochet,Fidel Castro,Hugo Chávez,Jorge Rafael Videla,2,Histoire,pinochet,,,,,,
S,,"Dans quel pays actuel se déroule l'action du roman ""L'Étranger"" (1942) ?",L'Algérie,La France,Le Liban,L'Espagne,2,Littérature,-,,,,,,
S,,Quelle est la couleur d'un billet de 100 euros ?,Vert,Orange,Bleu,Jaune,1,Économie & Politique,-,,,,,,
S,,Quel nom donne-t-on à une personne qui écrit et dessine des mangas ?,Mangaka,Sakuhaka,Komakka,Kakika,2,Jeux & BD,mangakas,,,,,,
S,,"Qui est l’auteur du manga ""One Piece"" ?",Eiichirō Oda,Akira Toriyama,Masashi Kishimoto,Tite Kubo,3,Jeux & BD,oda,,,,,,
S,,"Comment s’appelle l’île finale de la route de Grand Line dans le manga ""One Piece"" ?",Laugh Tale,Marineford,Whole Cake Island,Jaya,2,Jeux & BD,raftel,,,,,,
S,,Quel dessert normand à base de riz au lait est longuement cuit au four avec de la cannelle ?,La teurgoule,La flognarde,Le clafoutis,Le riz à l'impératrice,2,Gastronomie,teurd-goule | torgoule | tergoule,,,,,,
S,,Quelle eau-de-vie normande est élaborée à partir de cidre ?,Le calvados,L'armagnac,Le cognac,Le kirsch,2,Gastronomie,-,,,,,,
S,,Qui est la première femme à avoir reçu le prix Pritzker d’architecture ?,Zaha Hadid,Kazuyo Sejima,Odile Decq,Gae Aulenti,4,Arts & Culture,hadid,,,,,,
S,,"Quel sport pratiquait René Lacoste, le fondateur de la marque au crocodile ?",Le tennis,Le golf,Le rugby,L'équitation,2,Sport,-,,,,,,
S,,Quelle marque de vêtement a pour logo un crocodile ?,Lacoste,Fred Perry,Kappa,Tommy Hilfiger,1,Économie & Politique,la chemise lacoste,,,,,,
S,,Quel est le nom du personnage barbu qui garde les clés et les énigmes dans Fort Boyard ?,Le Père Fouras,Passe-Partout,Passe-Muraille,Mister Boo,1,Actualités & Médias,-,,,,,,
S,,Quelle est la couleur d'un billet de 200 euros ?,Jaune,Vert,Bleu,Violet,1,Économie & Politique,-,,,,,,
S,,Quel événement sportif majeur détermine le champion de la NFL ?,Le Super Bowl,Le Big Bowl,Le Mega Bowl,Le Grand Bowl,2,Sport,-,,,,,,
S,,Quel mot désigne le deuxième enfant d'une famille ?,Le cadet,L'aîné,Le benjamin,Le secondaire,1,Littérature,-,,,,,,
S,,Quel animal légendaire est l’emblème national de l’Écosse ?,La licorne,Le dragon,Le griffon,Le phénix,2,Géographie,-,,,,,,
S,,Quelle race de chien est devenue un symbole de la monarchie britannique sous Élisabeth II ?,Corgi,Beagle,Bichon maltais,Jack Russell terrier,2,Sciences de la vie,welsh corgi pembroke,,,,,,
S,,Où se déroule traditionnellement le couronnement des souverains britanniques ?,L’abbaye de Westminster,Le château de Windsor,La cathédrale Saint-Paul,Le palais de Buckingham,3,Histoire,westminster,,,,,,
S,,Dans quel océan se trouve le département français de Mayotte ?,Océan Indien,Océan Atlantique,Océan Pacifique,Océan Austral,1,Géographie,indien,,,,,,
S,,"Quelle île française est parfois surnommée ""l'île-hippocampe"" en raison de sa forme ?",Mayotte,La Martinique,La Réunion,La Guadeloupe,2,Géographie,-,,,,,,
S,,"Quelle est la signification de la lettre ""E"" dans l’acronyme UNESCO ?",Éducation,Économie,Environnement,État,2,Économie & Politique,-,,,,,,
S,,Quel nom donne-t-on aux forces de maintien de la paix de l’ONU ?,Casques bleus,Forces grises,Gardes de la paix,Soldats neutres,2,Économie & Politique,casque bleu,,,,,,
S,,Dans quelle ville se trouve le siège de l'Organisation des Nations unies (ONU) ?,New York,Bruxelles,Genève,La Haye,2,Économie & Politique,-,,,,,,
S,,Dans quel pays se trouve le canal de Suez ?,L'Égypte,L'Arabie Saoudite,La Libye,La Jordanie,2,Géographie,egypte,,,,,,
S,,Quel est le nom donné aux membres du crime organisé au Japon ?,Yakuza,Keimusho,Ashigaru,Shinigami,2,Divers,yakuzas,,,,,,
S,,Quel est le terme utilisé pour désigner le centre d’un cyclone ?,L’oeil,Le vortex,Le noyau,L'épicentre,1,Sciences exactes,oeil du cyclone,,,,,,
S,,Quel est le nom actuel de l’ancienne Guyane hollandaise ?,Le Suriname,Trinité-et-Tobago,Le Belize,Saint-Martin,3,Géographie,-,,,,,,
S,,À quel récipient associe-t-on historiquement la ville de Soissons ?,Un vase,Une amphore,Un tonneau,Une marmite,2,Histoire,-,,,,,,
S,,"Complétez ce proverbe : ""La nuit, tous les chats sont...""",Gris,Noirs,Blancs,Roux,1,Littérature,-,,,,,,
S,,Comment s'appelle la place centrale de Moscou ?,La place Rouge,La place Blanche,La place Grise,La place Bleue,2,Géographie,rouge | red square,,,,,,
S,,"Quel acronyme anglais signifie ""dès que possible"" ?",ASAP,TBD,BRB,ETA,2,Technologie,-,1,,,,,
S,,Quel animal terrifie l'aventurier Indiana Jones ?,Les serpents,Les araignées,Les rats,Les scorpions,2,Cinéma & Séries,serpent,,,,,,
S,,Quel pays de l’Union Européenne possède un hymne national sans paroles officielles ?,L'Espagne,L'Italie,Les Pays-Bas,L'Allemagne,3,Musique,-,,,,,,
S,,Quel mot d'origine grecque désigne une variété de citron ?,Eureka,Eros,Physis,Chronos,3,Gastronomie,-,,,,,,
S,,"Quelle plante sauvage appelle-t-on aussi la ""dent-de-lion"" ?",Le pissenlit,L'ortie,Le plantain,La chicorée,2,Sciences de la vie,-,,,,,,
S,,"Quelle ville de Bretagne portait le nom de ""Napoléonville"" sous le Premier Empire ?",Pontivy,Quimper,Auray,Saint-Malo,4,Géographie,-,,,,,,
S,,Quel aviateur est le premier à avoir dépassé la vitesse du son en 1947 ?,Chuck Yeager,Charles Lindbergh,Jacqueline Cochran,Scott Crossfield,3,Technologie,yeager | charles elwood yeager,,,,,,
S,,Quel tournoi de tennis du Grand Chelem se joue exclusivement sur gazon ?,Wimbledon,Roland-Garros,US Open,Open d'Australie,2,Sport,tournoi de wimbledon | the championships,,,,,,
S,,"Quelle ville est surnommée ""la ville trois fois sainte"" ?",Jérusalem,Istanbul,Médine,Lourdes,2,Croyances,-,,,,,,
S,,Quel est le terme anatomique pour désigner la pointe de la langue ?,Apex,Dorsum,Radix,Frenulum,3,Sciences de la vie,-,,,,,,
S,,En l'honneur de quel dieu grec étaient célébrés les jeux olympiques antiques ?,Zeus,Apollon,Athéna,Hermès,2,Croyances,-,,,,,,
S,,"Quel est le véritable nom de Neo dans le film ""Matrix"" (1999) ?",Thomas Anderson,Jack Harper,John Connor,Clark Kent,3,Cinéma & Séries,anderson,,,,,,
S,,"Quel personnage propose la pilule rouge à Neo dans le film ""Matrix"" (1999) ?",Morpheus,Trinity,Cypher,Smith,3,Cinéma & Séries,-,,,,,,
S,,"Quelle est la marque de la voiture conduite par Walt Kowalski dans le film ""Gran Torino"" (2008) ?",Ford,Chevrolet,Dodge,Pontiac,3,Cinéma & Séries,-,,,,,,
S,,"Quel acteur interprète le rôle de Walt Kowalski dans le film ""Gran Torino"" (2008) ?",Clint Eastwood,Harrison Ford,Robert De Niro,Mel Gibson,2,Cinéma & Séries,eastwood | clint eastwood jr,,,,,,
S,,"Quel objet les deux prisonniers doivent-ils utiliser pour tenter de se libérer dans le film ""Saw"" (2004) ?",Une scie,Une pince coupante,Un marteau,Une clé,3,Cinéma & Séries,scie a metaux,,,,,,
S,,"Quel surnom porte le tueur qui piège ses victimes dans des jeux mortels dans le film ""Saw"" (2004) ?",Jigsaw,The Riddler,Ghostface,Zodiac,3,Cinéma & Séries,-,,,,,,
S,,"Quel événement le personnage principal revit-il sans cesse dans le film ""Un jour sans fin"" (1993) ? ",Le jour de la marmotte,Le jour du hérisson,Le jour de l'écureuil,Le jour de la taupe,3,Cinéma & Séries,groundhog day,,,,,,
S,,"Quel est le nom de la princesse élevée par les loups dans le film ""Princesse Mononoké"" (1997) ?",San,Moro,Kaya,Yuki,3,Cinéma & Séries,-,,,,,,
S,,"Quel est le nom du robot dont Wall-E tombe amoureux dans le film ""Wall-E"" (2008) ?",Eve,Ada,Otto,Hal,3,Cinéma & Séries,-,,,,,,
S,,"Comment s'appelle l'entraîneur de Rocky dans le film ""Rocky"" (1976) ?",Mickey,Paulie,Duke,Tony,4,Cinéma & Séries,mickey goldmill | goldmill,,,,,,
S,,"Qui est l'adversaire de Rocky lors du combat final du film ""Rocky"" (1976) ?",Apollo Creed,Ivan Drago,Tommy Gunn,Clubber Lang,3,Cinéma & Séries,apollo | creed,,,,,,
S,,"Quel est le surnom du tueur en série traqué par le FBI dans le film ""Le Silence des agneaux"" (1991) ?",Buffalo Bill,Hannibal Lecter,Jack Crawford,The Ripper,3,Cinéma & Séries,-,,,,,,
S,,"Quel personnage est interprété par Anthony Hopkins dans le film ""Le Silence des agneaux"" (1991) ?",Hannibal Lecter,Buffalo Bill,Jack Crawford,Mason Verger,2,Cinéma & Séries,lecter | hannibal,,,,,,
S,,"Quel chanteur conseille à Clarence de tuer le proxénète Drexl dans le film ""True Romance"" (1993) ?",Elvis Presley,Frank Sinatra,John Lennon,Bob Dylan,3,Cinéma & Séries,elvis | presley,,,,,,
S,,"Quel acteur interprète le rôle de Clarence Worley dans le film ""True Romance"" (1993) ?",Christian Slater,Val Kilmer,Gary Oldman,Nicolas Cage,3,Cinéma & Séries,slater,,,,,,
S,,"Quel prénom portait le peintre surnommé ""le Douanier Rousseau"" ?",Henri,Paul,Édouard,Auguste,2,Arts & Culture,henri rousseau,,,,,,
S,,Qui a été le premier athlète à courir le 100 mètres en moins de 10 secondes ?,Jim Hines,Jesse Owens,Carl Lewis,Usain Bolt,3,Sport,hines | james ray hines,,,,,,
S,,Quel trophée est décerné à l’équipe victorieuse du Top 14 ?,Le bouclier de Brennus,La coupe Webb Ellis,Le trophée Jean Prat,L'ovale d'or,2,Sport,-,,,,,,
S,,"Comment se nomme le chat de la marâtre dans le film d'animation ""Cendrillon"" (1950) ?",Lucifer,Dinah,Bruton,Boniface,3,Cinéma & Séries,-,,,,,,
S,,"Quel acronyme désigne le ""mauvais cholestérol"" dans les analyses sanguines ?",LDL,TGL,HDL,IDL,2,Sciences de la vie,-,1,,,,,
S,,"Qui est le Prince de Sang-Mêlé dans l'univers de ""Harry Potter"" ?",Severus Rogue,Albus Dumbledore,Drago Malefoy,Harry Potter,2,Cinéma & Séries,rogue | severus snape | snape,,,,,,
S,,Dans quel pays se situe la cité troglodyte de Pétra ?,La Jordanie,L'Égypte,L'Arabie Saoudite,Le Liban,3,Géographie,-,,,,,,
S,,"Quel chevalier breton était surnommé le ""Dogue noir de Brocéliande"" ?",Bertrand du Guesclin,Olivier de Clisson,Gilles de Rais,Arthur de Richemont,3,Histoire,du guesclin | duguesclin,,,,,,
S,,"À quel artiste est consacré le film ""Rocketman"" (2019) ?",Elton John,Freddie Mercury,Mick Jagger,George Michael,2,Cinéma & Séries,john | reginald kenneth dwight,,,,,,
S,,Dans quelle ville se situe le siège de l'UNESCO ?,Paris,Rome,New York,Genève,3,Économie & Politique,-,,,,,,
S,,Comment désignait-on les gladiateurs qui combattaient avec un trident et un filet ?,Les rétiaires,Les dimachères,Les mirmillons,Les thraces,3,Histoire,retiaire | retiarius,,,,,,
S,,Quel est le nom de l'orifice respiratoire situé au sommet de la tête des cétacés ?,L'évent,Le spiracle,Le goulot,La fontanelle,2,Sciences de la vie,event,,,,,,
S,,"Quelle ville française est surnommée ""la cité corsaire"" ?",Saint-Malo,La Rochelle,Granville,Brest,3,Géographie,-,,,,,,
S,,"Quelle équipe nationale de rugby est surnommée le ""XV du Poireau"" ?",Le pays de Galles,L'Irlande,L'Angleterre,L'Écosse,2,Sport,-,,,,,,
S,,De quel animal Ganesh porte-t-il la tête selon la tradition hindoue ?,L'éléphant,Le tigre,Le singe,Le lion,2,Croyances,elephant,,,,,,
S,,"Quel instrument de musique est parfois familièrement surnommée la ""grand-mère"" ?",La contrebasse,La harpe,Le piano,Le violoncelle,4,Musique,-,,,,,,
S,,Dans quel pays actuel se situe la ville antique d'Éphèse ?,La Turquie,La Grèce,L'Italie,Chypre,3,Histoire,-,,,,,,
S,,Quel est le nom actuel de la ville antique de Lugdunum ?,Lyon,Lisbonne,Lourdes,Londres,2,Histoire,-,,,,,,
S,,Dans quel pays actuel se situe la ville antique de Babylone ?,L'Irak,La Turquie,La Grèce,La Jordanie,3,Histoire,-,,,,,,
S,,"Dans la Bible, comment s'appelle le troisième fils d'Adam et Ève ?",Seth,Caïn,Abel,Noé,3,Croyances,-,,,,,,
S,,Quel animal est le plus cité dans les titres des fables de La Fontaine ?,Le renard,Le rat,Le lion,Le loup,3,Littérature,-,,,,,,
S,,Quelle échelle sert à exprimer la force des piments ?,L'échelle de Scoville,L'échelle de Brinell,L'échelle de Weber,L'échelle de Piquance,2,Gastronomie,scoville,,,,,,
S,,"Quelle fable de La Fontaine a pour morale : ""Tel est pris qui croyait prendre"" ?",Le Rat et l’Huître,Le Loup et l’Agneau,Le Renard et la Cigogne,La Cigale et la Fourmi,3,Littérature,-,,,,,,
S,,Quel est le symbole chimique de l'hydrogène dans le tableau périodique des éléments ?,H,O,C,Hy,1,Sciences exactes,-,1,,,,,
S,,Quel est le symbole chimique de l'hélium dans le tableau périodique des éléments ?,He,H,Hu,Hl,1,Sciences exactes,-,1,,,,,
S,8,"Quel peintre est l'auteur de ""Autoportrait à l'oreille bandée"" (1889) ?",Vincent van Gogh,Paul Gauguin,Claude Monet,Georges Seurat,1,Arts & Culture,van gogh,,,,,,
S,9,"Quel peintre est l'auteur de ""Crâne de squelette fumant une cigarette"" (1886) ?",Vincent van Gogh,Edvard Munch,Francisco de Goya,Egon Schiele,3,Arts & Culture,van gogh,,,,,,
S,10,"Quel peintre est l'auteur de ""La Nuit étoilée"" (1889) ?",Vincent van Gogh,Paul Cézanne,Henri de Toulouse-Lautrec,Claude Monet,1,Arts & Culture,van gogh,,,,,,
S,11,"Quel peintre est l'auteur de ""Les Tournesols"" (1889) ?",Vincent van Gogh,Henri Matisse,Edvard Munch,Paul Cézanne,1,Arts & Culture,van gogh,,,,,,
S,12,"Quel peintre est l'auteur de ""Les Mangeurs de pommes de terre"" (1885) ?",Vincent van Gogh,Jean-François Millet,Camille Pissaro,Gustave Courbet,3,Arts & Culture,van gogh,,,,,,
S,13,"Quel peintre est l'auteur de ""Champ de blé aux corbeaux"" (1890) ?",Vincent van Gogh,Paul Cézanne,Camille Pissaro,Jean-François Millet,3,Arts & Culture,van gogh,,,,,,
S,14,"Quel peintre est l'auteur de ""La Chambre à Arles"" (1889) ?",Vincent van Gogh,Paul Gauguin,Henri de Toulouse-Lautrec,Édouard Manet,3,Arts & Culture,van gogh,,,,,,
S,15,"Quel peintre est l'auteur de ""La Promenade"" (1875) ?",Claude Monet,Pierre-Auguste Renoir,Édouard Manet,Edgar Degas,2,Arts & Culture,monet,,,,,,
S,16,"Quel peintre est l'auteur de ""Les Coquelicots"" (1873) ?",Claude Monet,Alfred Sisley,Vincent van Gogh,Camille Pissaro,2,Arts & Culture,monet,,,,,,
S,17,"Quel peintre est l'auteur de ""Promenade sur la falaise, Pourville"" (1882) ?",Claude Monet,Berthe Morisot,Pierre-Auguste Renoir,Paul Cézanne,3,Arts & Culture,monet,,,,,,
S,18,"Quel peintre est l'auteur de ""La Grenouillère"" (1869) ?",Claude Monet,Gustave Caillebotte,Camille Pissaro,Édouard Manet,3,Arts & Culture,monet,,,,,,
S,19,"Quel peintre est l'auteur de ""La Pie"" (1869) ?",Claude Monet,Jean-Baptiste Camille Corot,Gustave Courbet,Alfred Sisley,3,Arts & Culture,monet,,,,,,
S,20,"Quel peintre est l'auteur de ""La Gare Saint-Lazare"" (1877) ?",Claude Monet,Édouard Manet,Pierre-Auguste Renoir,Camille Pissaro,3,Arts & Culture,monet,,,,,,
S,21,"Quel peintre est l'auteur de ""Régates à Argenteuil"" (1872) ?",Claude Monet,Gustave Caillebotte,Pierre-Auguste Renoir,Alfred Sisley,3,Arts & Culture,monet,,,,,,
S,22,"Quel peintre est l'auteur de ""La Tamise et le Parlement"" (1871) ?",Claude Monet,J.M.W. Turner,John Constable,Camille Pissaro,3,Arts & Culture,monet,,,,,,
S,23,"Quel peintre est l'auteur de ""Printemps"" (1872) ?",Claude Monet,Élisabeth Vigée Le Brun,Édouard Manet,Berthe Morisot,3,Arts & Culture,monet,,,,,,
S,24,"Quel peintre est l'auteur de ""Le Pont d'Argenteuil"" (1874) ?",Claude Monet,Gustave Caillebotte,Pierre-Auguste Renoir,Alfred Sisley,3,Arts & Culture,monet,,,,,,
S,25,"Quel peintre est l'auteur de ""Impression, Soleil levant"" (1872) ?",Claude Monet,Pierre-Auguste Renoir,Camille Pissaro,Alfred Sisley,2,Arts & Culture,monet,,,,,,
S,26,"Quel peintre est l'auteur de ""Saturne dévorant un de ses fils"" (1823) ?",Francisco de Goya,Edvard Munch,Hieronymus Bosch,Théodore Géricault,2,Arts & Culture,de goya | goya,,,,,,
S,27,"Quel peintre est l'auteur de ""Tres de mayo"" (1814) ?",Francisco de Goya,Eugène Delacroix,Diego Velázquez,Francisco de Zurbarán,2,Arts & Culture,de goya | goya,,,,,,
S,28,"Quel peintre est l'auteur de ""La maja nue"" (1800) ?",Francisco de Goya,Titien,Édouard Manet,Jean-Auguste-Dominique Ingres,3,Arts & Culture,de goya | goya,,,,,,
S,29,"Quel peintre est l'auteur de ""La famille de Charles IV"" (1800) ?",Francisco de Goya,Jacques-Louis David,Jean-Auguste-Dominique Ingres,Élisabeth Vigée Le Brun,3,Arts & Culture,de goya | goya,,,,,,
S,30,"Quel peintre est l'auteur de ""Le Sabbat des sorcières"" (1798) ?",Francisco de Goya,Hieronymus Bosch,Pieter Bruegel l’Ancien,Henry Fuseli,3,Arts & Culture,de goya | goya,,,,,,
S,31,"Quel peintre est l'auteur de ""La Laitière de Bordeaux"" (1827) ?",Francisco de Goya,Jean-Baptiste Greuze,Bartolomé Esteban Murillo,Eugène Delacroix,4,Arts & Culture,de goya | goya,,,,,,
S,32,"Quel peintre est l'auteur de ""L'Adoration du nom de Dieu"" (1772) ?",Francisco de Goya,El Greco,Giovanni Battista Tiepolo,Bartolomé Esteban Murillo,3,Arts & Culture,de goya | goya,,,,,,
S,,"Quel artiste interprète ""God's Plan"" (2018) ?",Drake,Kendrick Lamar,Travis Scott,Kanye West,2,Musique,aubrey drake graham,,,,,,
S,,"Quel artiste interprète ""Perfect"" (2018) ?",Ed Sheeran,Sam Smith,James Blunt,Lewis Capaldi,2,Musique,sheeran | edward christopher sheeran,,,,,,
S,,"Quel artiste interprète ""Havana"" (2018) ?",Camila Cabello,Dua Lipa,Selena Gomez,Ariana Grande,2,Musique,cabello | young thug,,,,,,
S,,Quel homme politique français a été maire de Bordeaux de 1947 à 1995 ?,Jacques Chaban-Delmas,Alain Juppé,Michel Debré,Édouard Balladur,3,Économie & Politique,chaban delmas | delmas,,,,,,
S,,Quel homme politique français a été maire de Marseille de 1995 à 2020 ?,Jean-Claude Gaudin,Gaston Defferre,Samia Ghali,Robert Vigouroux,3,Économie & Politique,gaudin,,,,,,
S,,Quel homme politique français a été maire de Paris de 1977 à 1995 ?,Jacques Chirac,Valéry Giscard d'Estaing,François Miterrand,Nicolas Sarkozy,2,Économie & Politique,chirac,,,,,,
S,,Quel homme politique français a été maire de Paris de 2001 à 2014 ?,Bertrand Delanoë,Jacques Chirac,Jean Tiberi,Anne Hidalgo,3,Économie & Politique,delanoe,,,,,,
S,,Quel homme politique français a été maire de Bordeaux de 1995 à 2004 puis de 2006 à 2019 ?,Alain Juppé,François Bayrou,Dominique de Villepin,Jacques Chaban-Delmas,2,Économie & Politique,juppe,,,,,,
S,,Quel homme politique français a été maire de Marseille de 1953 à 1986 ?,Gaston Defferre,Pierre Mauroy,Alain Juppé,Edmond Garcin,3,Économie & Politique,defferre,,,,,,
S,,Quel homme politique français a été maire de Tulle de 2001 à 2008 ?,François Hollande,Manuel Valls,Michel Rocard,Lionel Jospin,2,Économie & Politique,hollande,,,,,,
S,,Quel homme politique français a été maire de Neuilly-sur-Seine de 1983 à 2002 ?,Nicolas Sarkozy,Charles Pasqua,Patrick Balkany,Jean-Christophe Fromantin,2,Économie & Politique,sarkozy,,,,,,
S,,Quel homme politique français a été maire de Nantes de 1989 à 2012 ?,Jean-Marc Ayrault,François Fillon,Édouard Philippe,Alain Juppé,3,Économie & Politique,ayrault,,,,,,
S,,Quel homme politique français a été maire de Lille de 1973 à 2001 ?,Pierre Mauroy,Lionel Jospin,Martine Aubry,Gaston Defferre,3,Économie & Politique,mauroy,,,,,,
S,,Quel homme politique français a été maire de Levallois-Perret de 1983 à 1995 puis de 2001 à 2020 ?,Patrick Balkany,André Santini,Charles Pasqua,Roger Karoutchi,3,Économie & Politique,balkany,,,,,,
S,,Quel femme politique française a été maire de Lille de 2001 à 2025 ?,Martine Aubry,Ségolène Royal,Anne Hidalgo,Christiane Taubira,3,Économie & Politique,aubry,,,,,,
S,,Quelle est la fosse sous-marine la plus profonde de la planète Terre ?,La fosse des Mariannes,La fosse des Tonga,La fosse des Kermadec,La fosse du Japon,1,Géographie,mariannes,,,,,,
S,,"Quel est le nom du point le plus profond connu des océans, situé dans la fosse des Mariannes ?",Challenger Deep,Sirena Deep,Horizon Deep,Factorian Deep,2,Géographie,-,,,,,,
S,,Quelle arme incendiaire a fait la puissance navale de l'Empire byzantin au Moyen Âge ?,Le feu grégeois,Le napalm,Le vitriol,La poudre noire,3,Histoire,-,,,,,,
