id,img,question,A,B,C,D,difficulte,theme,fuzzy,frequence,exact,,,,,
4IOI,,Dans quelle ville se sont tenus les premiers Jeux olympiques modernes en 1896 ?,Athènes,Paris,Londres,Rome,2,Sport,-,,,,,,,
Y7UY,,Quel est le nom du fondateur des Jeux olympiques modernes ?,Pierre de Coubertin,Jules Rimet,Georges Hébert,Émile Durkheim,2,Sport,coubertin | baron coubertin | baron pierre coubertin,,,,,,,
KSSH,,"Quel dirigeant sportif, président de la FIFA, a créé la Coupe du monde de football en 1930 ?",Jules Rimet,Henri Delaunay,Stanley Rous,João Havelange,3,Sport,rimet,,,,,,,
KJJJ,,Dans quel pays s'est tenue la première Coupe du monde de football en 1930 ?,L'Uruguay,La France,Le Brésil,L'Allemagne,3,Sport,-,,,,,,,
16GN,,Quel inventeur français est à l'origine du procédé permettant la mise en conserve des aliments en 1795 ?,Nicolas Appert,Denis Papin,Apollinaire Bouchardat,Antoine Parmentier,3,Gastronomie,appert,,,,,,,
LO3W,,Dans quelle ville d'Île-de-France Nicolas Appert a-t-il installé la première usine de conserves au monde en 1802 ?,Massy,Bourg-la-Reine,Montrouge,Ivry-sur-Seine,4,Société,-,,,,,,,
HC2B,,"Selon la tradition chrétienne, à quelle méthode d'exécution Jésus a-t-il été condamné ?",La crucifixion,L'écartèlement,La strangulation,L'égorgement,1,Croyances,crucifiement,,,,,,,
VPUR,,À quel dieu de la mythologie grecque associe-t-on le dieu romain Jupiter ?,Zeus,Arès,Poséidon,Cronos,1,Croyances,-,,,,,,,
0QJE,,"D'après les récits chrétiens, sur quel mont Jésus serait-il monté au ciel après sa résurrection ?",Le mont des Oliviers,Le mont Thabor,Le Sinaï,Le mont Nébo,2,Croyances,oliviers,,,,,,,
UQSG,,"D'après les récits évangéliques, sur quelle colline, également appelée ""lieu du Crâne"", Jésus a-t-il été crucifié ?",Le Golgotha,Le mont des Oliviers,Le Sinaï,Le mont Sion,3,Croyances,calvaire,,,,,,,
DJ0C,,"À quelle marque automobile associe-t-on les modèles Qashqai, Sentra et Leaf ?",Nissan,Kia,Mazda,Toyota,2,Société,-,,,,,,,
9XM7,,Dans quel État américain se situe l'université de Harvard ?,Le Massachussets,New York,La Pennsylvanie,Le Connecticut,3,Divers,-,,,,,,,
K4KR,,"En droit français du travail, quelle est la signification de la lettre I de l'acronyme ""CDI"" ?",Indéterminée,Illicite,Intermittente,Individuelle,1,Société,-,,,,,,,
V8N2,,Quelle est la couleur du maillot porté par le leader du classement général du Tour de France ?,Jaune,Vert,Rose,Blanc,1,Sport,-,,,,,,,
81Q3,,Quelle ville fut la première capitale du royaume d'Italie après son unification en 1861 ?,Turin,Florence,Rome,Naples,3,Histoire,torino,,,,,,,
PWCB,,"Quelle ville italienne est appelée ""Torino"" dans sa langue locale ?",Turin,Parme,Vérone,Trieste,1,Géographie,-,,,,,,,
EAEC,,Quel Premier ministre du Royaume-Uni a démissionné suite aux élections législatives de 2010 ?,Gordon Brown,Tony Blair,David Cameron,John Major,2,Société,brown,,,,,,,
83P0,,Quel est le nombre maximal d'étoiles qu'un restaurant peut obtenir dans le guide Michelin ?,3,2,4,5,1,Gastronomie,trois | 3 etoiles | trois etoiles,1,,,,,,
KUXG,,"Quel est le nom du plat préféré de Casimir dans l'émission ""L'Île aux enfants"" ?",Le gloubi-boulga,Le froubi-fralga,Le troubi-tramba,Le grabli-cramba,2,Audiovisuel,-,,,,,,,
DEXX,,Quel nom porte la rue la plus étroite de Paris ?,Le Chat-qui-Pêche,La Loutre-qui-Bâille,Le Hibou-qui-Boude,Le Chien-qui-Guette,3,Géographie,rue du chat qui peche,,,,,,,
ZDEA,,"Quelle association américaine, fondée en 1871, défend le droit à la possession d'armes aux États-Unis ?",La NRA,L'AHEC,La NAST,L'USACF,2,Société,national rifle association of america,,,,,,,
NHE1,,"Quel est le nom complet du jeu vidéo désigné par le sigle ""COD"" ?",Call of Duty,Code Red,Chronicles of Descent,Cyber Ops Delta,1,Pop culture,-,,,,,,,
6CWQ,,Quel scientifique a reçu le prix Nobel de médecine 1952 pour la découverte de la streptomycine ?,Selman Waksman,Alexander Fleming,René Dubos,Howard Florey,4,Nature,waksman,,,,,,,
LSES,,"Quel antibiotique, découvert en 1943 par Selman Waksman, fut le premier à soigner efficacement la tuberculose ?",La streptomycine,La pénicilline,La rifampicine,La sulfadiazine,4,Nature,-,,,,,,,
2NU1,,Quel terme qualifie un médicament capable d'inhiber la division cellulaire ?,Cytostatique,Cytotoxique,Cytocide,Cytolytique,4,Nature,-,,,,,,,
KCP3,,Contre quel type d'organismes agissent spécifiquement les antibiotiques ?,Les bactéries,Les virus,Les champignons,Les prions,2,Nature,-,,,,,,,
43J5,,"Quel personnage de la série ""South Park"" porte un bonnet bleu à pompon rouge ?",Stanley Marsh,Kyle Broflovski,Eric Cartman,Kenny McCormick,2,Audiovisuel,stan | stan marsh | stanley,,,,,,,
O5UZ,726,Quel fruit a donné son nom au grand col plissé à plusieurs rangs porté au XVIe siècle ?,La fraise,La cerise,La pomme,La figue,3,Arts,col fraise,,,,,,,
JYA3,,"De quel groupe de K-pop les membres de la communauté ""ARMY"" sont-ils fans ?",BTS,BLACKPINK,Stray Kids,Seventeen,2,Musique,bangtan boys | bangtan sonyeondan,,,,,,,
NRDR,,Quel insecte est responsable de la transmission du chikungunya à l'être humain ?,Le moustique,La tique,La mouche,La guèpe,1,Nature,moustiques,,,,,,,
DZ6K,,Qui a succédé à John Textor à la présidence de l'Olympique Lyonnais en 2025 ?,Michele Kang,Sonia Souid,Julie Uhrman,Kathleen Kruger,2,Sport,kang | yongmee michele kang,,,,,,,
10T1,,Quel organisme public français est compétent pour traiter les situations de surendettement des particuliers ?,La Banque de France,Le Trésor public,La préfecture,La CAF,2,Société,-,,,,,,,
HNOA,,"Qui est l'actuel gouverneur de la Banque de France, en fonction depuis 2015 ?",François Villeroy de Galhau,Christian Noyer,Sylvie Goulard,Jean-Claude Trichet,3,Société,villeroy de galhau,,,,,,,
V77W,,"Dans la tradition chrétienne, quel saint est symboliquement chargé de garder les clés du royaume des cieux ?",Saint Pierre,Saint Paul,Saint Jean,Saint Jacques,2,Croyances,pierre,,,,,,,
61W2,,Quel est le département le moins peuplé de France métropolitaine ?,La Lozère,La Creuse,Le Cantal,L'Ariège,3,Géographie,-,,,,,,,
N7EW,,Quelle est la seule espèce d'ours vivant en Amérique du Sud ?,L'ours à lunettes,L'ours lippu,Le baribal,L'ours des cocotiers,3,Nature,a lunettes | tremarctos ornatus,,,,,,,
00L5,727,"Dans quelle ville se situe la place Plumereau, connue pour ses maisons à colombages ?",Tours,Angers,Amboise,Nantes,3,Géographie,-,,,,,,,
QXBR,,À quel style architectural appartient la cathédrale Notre-Dame de Paris ?,Gothique,Baroque,Classique,Roman,2,Arts,style gothique,,,,,,,
QFKZ,,Quel animal orne le sommet de la flèche de Notre-Dame de Paris ?,Un coq,Un lion,Une colombe,Un bélier,3,Arts,-,,,,,,,
PSTP,,"Combien de personnages comporte traditionnellement le jeu des ""Sept Familles"" ?",42,35,49,28,2,Pop culture,quarante deux | 42 personnages | quarante deux personnages,1,,,,,,
RLSB,,Quel instrument météorologique est utilisé pour mesurer l'épaisseur de la neige ?,Un nivomètre,Un cryomètre,Un hygromètre,Un pluviomètre,3,Science,-,,,,,,,
VC8W,728,"Quel site géologique d'Auvergne, inscrit au patrimoine mondial de l'UNESCO, est constitué d'un alignement de plus de 80 volcans ?",La chaîne des Puys,La Margeride,Les monts du Forez,Le massif du Sancy,2,Nature,monts dome,,,,,,,
QPA1,,Quel réseau social Elon Musk a-t-il racheté en 2022 pour environ 44 milliards de dollars ?,Twitter,TikTok,LinkedIn,Snapchat,1,Société,-,,,,,,,
PPPM,,"Comment appelle-t-on la partie terminale d'une tige de maïs, formée de nombreux grains ?",L'épi,La cosse,Le régime,La gousse,1,Nature,épi de mais,,,,,,,
G94P,,"En quelle année l'hémisphère Nord a-t-il connu ""l'année sans été"", marquée par un refroidissement climatique exceptionnel ?",1816,1783,1835,1883,3,Histoire,mille huit cent seize,1,,,,,,
3UA4,,"Quel volcan indonésien est à l'origine de ""l'année sans été"" de 1816 ?",Le Tambora,Le Krakatoa,Le Laki,Le Pinatubo,3,Nature,-,,,,,,,
F9GH,,Quelle petite fleur blanche et jaune doit son nom à sa floraison autour de la période de Pâques ?,La pâquerette,La jonquille,La marguerite,La primevère,1,Nature,ellis perennis,,,,,,,
6F1L,,"Quel réalisateur a prêté sa voix au personnage de Stan Marsh dans la version québécoise de la série ""South Park"" ?",Xavier Dolan,Jean-Marc Vallée,Denis Villeneuve,Philippe Falardeau,3,Audiovisuel,dolan,,,,,,,
6GHZ,,"Quel insecte est surnommé ""bête à bon Dieu"" dans le langage populaire ?",La coccinelle,Le scarabée,L'abeille,La luciole,2,Nature,coccinellidés | coccinellidae,,,,,,,
3B8J,,"Quelle chanson d'Henri Salvador inspira Goscinny et Uderzo pour créer la bande dessinée ""Astérix et Obélix"" ?",Faut rigoler,La Java Bleue,Zorro est arrivé,Syracuse,4,Musique,-,,,,,,,
XPSM,,"À quelle route, reliant Paris à la Côte d'Azur, Charles Trenet rend-il hommage dans l'une de ses chansons ?",La Nationale 7,L'Autoroute A7,La Route Napoléon,La Route Cézanne,3,Musique,rn7 | national 7 | nationale sept | national sept,1,,,,,,
8PNP,,Quel peintre a donné son nom à une route touristique reliant la ville d'Aix-en-Provence au village du Tholonet ?,Paul Cézanne,Henri Matisse,Pablo Picasso,Auguste Renoir,3,Arts,cezanne,,,,,,,
Q168,729,De quel pays est originaire le fromage Gouda ?,Les Pays-Bas,La Suisse,L'Allemagne,L'Autriche,2,Gastronomie,hollande,,,,,,,
P2V3,,"À quel pays associe-t-on l'industrie cinématographique surnommée ""Bollywood"" ?",L'Inde,La Chine,La Grèce,L'Arabie saoudite,1,Audiovisuel,-,,,,,,,
0ILJ,,"Sous quel pseudonyme Stephen King a-t-il publié ses romans ""Rage"" et ""Marche ou crève"" ?",Richard Bachman,Joe Hill,Alan Brewer,Raymond Fleming,3,Littérature,bachman,,,,,,,
TK3Z,,Quel nom donne-t-on à la musique d'ambiance conçue pour être diffusée dans les ascenseurs ou les halls d'attente ?,La muzak,La softwave,La sonamasse,Le mellowsound,3,Musique,-,,,,,,,
K1XD,,Quel jeu pratique un cruciverbiste ?,Les mots croisés,Les charades,Les sudoku,Les mots fléchés,2,Pop culture,-,,,,,,,
O89D,,"Quel romancier a publié ""Les Aventures du capitaine Hatteras"" en 1866 ?",Jules Verne,Arthur Conan Doyle,H. G. Wells,Robert Louis Stevenson,2,Littérature,verne,,,,,,,
Z79A,,Quel détroit guadeloupéen sépare l'île de Basse-Terre à l'ouest de l'île de Grande-Terre à l'est ?,La Rivière Salée,Le canal des Saintes,La Passe à Colas,Le chenal du Four,3,Géographie,-,,,,,,,
DTKK,,Dans quelle saga les Autobots affrontent-ils les Decepticons ?,Transformers,Alien,Matrix,Mad Max,2,Audiovisuel,-,,,,,,,
X7Y3,730,Comment appelle-t-on les émissions de gaz observées à proximité des volcans ?,Les fumerolles,Les solfatares,Les mofettes,Les lahars,3,Nature,fumerolle | fumerole | fumeroles,,,,,,,
QX3H,,Quel régime politique fut instauré en France après la dissolution de la Convention nationale en 1795 ?,Le Directoire,Le Consulat,L'Empire,La Législative,3,Histoire,premiere republique directoire,,,,,,,
OVSO,,Quel félin a donné son nom à une opération militaire française menée au Mali en 2013 ?,Le serval,Le guépard,Le lynx,Le caracal,3,Société,operation serval,,,,,,,
PPE3,,Lors de quelle bataille le roi Jean II le Bon fut-il capturé par les Anglais en 1356 ?,La bataille de Poitiers,La bataille de Crécy,La bataille d'Azincourt,La bataille de Formigny,3,Histoire,poitiers,,,,,,,
Y2U2,,"Quelle est la profession du plongeur qui capture Nemo dans le film ""Le Monde de Nemo"" ?",Dentiste,Photographe,Facteur,Boxeur,2,Audiovisuel,-,,,,,,,
R1ZW,,Quel empire s'est emparé de la ville de Constantinople en 1453 ?,L'Empire ottoman,L'Empire perse,L'Empire mongol,L'Empire bulgare,2,Histoire,ottoman,,,,,,,
ECUU,,Sous quel nom connaît-on mieux l'empereur Frédéric Ier de Hohenstaufen ?,Barberousse,Barbe bleue,Barbe Noire,Barbe d'Or,3,Histoire,-,,,,,,,
9O8I,,Quel tournoi majeur de tennis se joue chaque année sur terre battue au Foro Italico ?,Le tournoi de Rome,Le tournoi de Florence,Le Next Gen Finals,La Coupe Davis,3,Sport,rome | tournoi tennis rome | internationaux italie | masters rome | rome masters,,,,,,,
7W5Z,,"Quelle comédienne américaine a impulsé la diffusion du hashtag ""#MeToo"" sur Twitter en octobre 2017 ?",Alyssa Milano,Gwyneth Paltrow,Meryl Streep,Reese Witherspoon,3,Société,milano,,,,,,,
85XK,,"Dans quelle langue le mot ""babouchka"" signifie-t-il ""grand-mère"" ?",Le russe,Le serbe,Le polonais,Le hongrois,2,Littérature,-,,,,,,,
OQST,731,"Dans quel État américain peut-on emprunter l'Overseas Highway, une route construite sur l'eau ?",La Floride,La Californie,Le Mississippi,La Caroline du Sud,2,Géographie,-,,,,,,,
6GUE,,"Quel était le titre du magistrat suprême, élu à vie, qui gouvernait sur la République de Venise ?",Le doge,Le condottiere,Le gonfalonier,Le podestat,3,Histoire,-,,,,,,,
D8GN,,Quel titre portait l'épouse du doge de la République de Venise ?,La dogaresse,La patrice,La signoria,La comtesse,3,Histoire,-,,,,,,,
3X54,,"Dans l'appareil respiratoire humain, quel conduit cartilagineux permet de faire circuler l'air depuis le larynx jusqu'aux bronches ?",La trachée,L'œsophage,Le diaphragme,Le pharynx,2,Nature,-,,,,,,,
3ITG,732,Quel art martial japonais est fondé sur l'usage d'un long arc asymétrique et la recherche d'harmonie ?,Le kyūdō,Le yabusame,L'iaidō,Le kendo,3,Sport,-,,,,,,,
ODVE,,Qui fut le dernier roi de la dynastie des Valois en France ?,Henri III,Charles IX,Louis XII,François Ier,3,Histoire,henri 3 | henri trois,,1,,,,,
EPCA,,Quelle guerre opposa la Finlande à l'Union soviétique entre 1939 et 1940 ?,La guerre d'Hiver,La guerre de Carélie,La guerre russo-finlandaise,La guerre de Continuation,3,Histoire,hiver,,,,,,,
33CX,,Quelles protéines sont produites par le système immunitaire pour neutraliser ou signaler la présence d'antigènes ?,Les anticorps,Les lymphocytes,Les macrophages,Les cytokines,2,Nature,-,,,,,,,
Y7P6,,"Quel âge avait Jeanne Calment, doyenne de l'humanité, au moment de son décès ?",122 ans,118 ans,116 ans,120 ans,3,Société,122 | cent vingt deux | cent vingt deux ans,,1,,,,,
JYGI,,Quel mot d'origine hindoue désigne le dirigeant d'une secte ?,Un gourou,Un yogi,Un baba,Un maharishi,1,Croyances,-,,,,,,,
MUB1,,"Quel terme désigne une lésion ulcéreuse bénigne, souvent blanchâtre et douloureuse, qui se développe sur la muqueuse buccale ?",Un aphte,Une gingivite,Un bouton de fièvre,Un granulome,2,Nature,-,,,,,,,
1UU8,,"À quel groupe scout Riri, Fifi et Loulou appartiennent-ils ?",Les castors,Les louveteaux,Les colibris,Les marcassins,3,Pop culture,-,,,,,,,
PLAP,,"Quel pays insulaire d'Asie est surnommé la ""larme de l'Inde"" ?",Le Sri Lanka,Les Maldives,Le Bangladesh,L'Andaman,2,Géographie,-,,,,,,,
NH4B,,"Qui présente l'émission ""Clique"" sur Canal + depuis 2013 ?",Mouloud Achour,Isabelle Ithurburu,Ali Baddou,Thomas Thouroude,2,Audiovisuel,achour,,,,,,,
4ZOS,,Quel terme argotique désigne l'ensemble des équipements qu'un militaire porte avec lui lors de ses déplacements ?,Le barda,Le fourbi,La musette,Le brelage,3,Divers,-,,,,,,,
AS24,,Quel jeu consiste à retourner des cartes pour retrouver des paires identiques ?,Le memory,Le duo,Le reverso,Les 7 familles,2,Pop culture,-,,,,,,,
B5VA,,Quel astronaute américain prit le commandement de la mission Apollo 13 en 1970 ?,Jim Lovell,Fred Haise,Alan Shepard,Pete Conrad,3,Science,lovell | james lovell,,,,,,,
ATNX,,"Quelle mission lunaire américaine, lancée en 1970, est devenue célèbre suite à l'explosion de l'un de ses réservoirs d'oxygène ?",Apollo 13,Gemini 7,Apollo 11,Skylab 2,2,Science,apollo treize,,1,,,,,
P4NR,,"À quelle mission lunaire associe-t-on cette phrase : ""Houston, we've had a problem"" ?",Apollo 13,Gemini 7,Apollo 11,Skylab 2,2,Science,apollo treize,,1,,,,,
OHBC,,Quelle super-héroïne Scarlett Johansson incarne-t-elle dans les films Marvel ?,La Veuve noire,La Guêpe,Captain Marvel,Gamora,2,Audiovisuel,black widow | natasha romanoff,,,,,,,
NY9Y,,"Quelle chanteuse partage l'affiche du film ""Joker : Folie à deux"" avec Joaquin Phoenix ?",Lady Gaga,Zendaya,Rihanna,Dua Lipa,2,Audiovisuel,gaga | stefani germanotta | germanotta,,,,,,,
DCVW,,Quel oiseau légendaire meurt par le feu puis renaît de ses cendres ?,Le phénix,Le roc,Le griffon,L'oiseau-tonnerre,1,Croyances,-,,,,,,,
9GHL,733,Quel pays du Maghreb abrite le site archéologique de Carthage ?,La Tunisie,Le Maroc,L'Égypte,L'Algérie,2,Histoire,-,,,,,,,
OAF4,,"Quel arbre africain, reconnaissable à son tronc massif, est l'emblème du Sénégal ?",Le baobab,Le kapokier,L'acacia,Le fromager,2,Nature,baobab africain | adansonia digitata,,,,,,,
8U77,,"Quelle région alpine fut partagée, suite à la Première Guerre mondiale, entre l'Autriche et l'Italie ?",Le Tyrol,Le Trentin,Le Carniole,Le Vorarlberg,3,Géographie,tirol | tirolo,,,,,,,
SKUU,,Quelle couleur d'emballage permet d'identifier le lait entier en magasin ?,Le rouge,Le bleu,Le vert,Le jaune,2,Gastronomie,-,,,,,,,
7XZ5,,"Sous quel pont ""coule la Seine"" dans un poème de Guillaume Apollinaire ?",Le pont Mirabeau,Le pont Neuf,Le pont de l'Alma,Le pont des Arts,2,Littérature,mirabeau,,,,,,,
CLAD,,Quelle chanteuse fut la première à se produire au Stade de France en 1999 ?,Céline Dion,Mylène Farmer,Madonna,Tina Turner,3,Musique,dion,,,,,,,
88A9,,Quelle ville de Floride est considérée comme la capitale mondiale des parcs d'attractions ?,Orlando,Miami,Tampa,Jacksonville,2,Pop culture,-,,,,,,,
22V2,734,"Quel canal, d'une longueur de 278 kilomètres, relie la Garonne à la Méditerranée ?",Le canal du Midi,Le canal de Bourgogne,Le canal de Briare,Le canal de Lunel,2,Géographie,midi,,,,,,,
GKQ2,,"Quel ingénieur français, soutenu par Colbert et Louis XIV, conçut le canal du Midi, inauguré en 1681 ?",Pierre-Paul Riquet,Louis Le Vau,André Le Nôtre,Vauban,3,Arts,riquet,,,,,,,
D5WQ,,"Qui est le super-ami imaginaire d'Adèle dans la bande dessinée ""Mortelle Adèle"" ?",Magnus,Ajax,Ludwig,Félix,3,Pop culture,-,,,,,,,
PZJF,,"Quelle forêt est surnommée ""le poumon de la planète"" ?",La forêt amazonienne,La forêt du Congo,La forêt de Bornéo,La forêt canadienne,1,Nature,amazonienne | amazonie,,,,,,,
EDXV,,Quel animal donne son nom aux pinces utilisées pour connecter les batteries de deux voitures ?,Le crocodile,Le crabe,L'araignée,Le scarabée,1,Divers,pinces crocodile,,,,,,,
HLU5,,Quelle région française doit son nom à son occupation par les Vikings au Xe siècle ?,La Normandie,La Bretagne,La Picardie,La Vendée,1,Géographie,-,,,,,,,
VFD2,,Quelle volaille est utilisée dans la préparation de la salade périgourdine ?,Le canard,Le poulet,L'oie,La dinde,2,Gastronomie,-,,,,,,,
L351,735,Quelle artiste fut la modèle et l'unique élève d'Auguste Renoir ?,Jeanne Baudot,Gabrielle Renard,Aline Charigot,Suzanne Valadon,3,Arts,baudot,,,,,,,
UCTD,,Quel était le nom de la compagnie maritime qui possédait le Titanic ?,La White Star Line,La Cunard Line,La Royal Mail Line,La Hamburg America Line,4,Société,-,,,,,,,
CSML,,Dans quelle ville française a été créé le biscuit petit-beurre ?,Nantes,La Rochelle,Bordeaux,Rennes,2,Gastronomie,-,,,,,,,
0UHU,,"Avec le cyan, le magenta et le noir, quelle est la quatrième couleur utilisée en quadrichromie ?",Le jaune,Le vert,Le blanc,L'orange,2,Arts,-,,,,,,,
BRIX,,Comment appelle-t-on la neige fraîche et légère appréciée des skieurs hors-piste ?,La poudreuse,La soupe,La croûtée,La trafolée,2,Sport,-,,,,,,,
04R6,,Quel terme maritime désigne l'ensemble du matériel permettant de propulser et de manœuvrer un voilier ?,Le gréement,La carène,Le haubanage,L'armement,3,Divers,-,,,,,,,
L1FD,,"Quel tueur aux griffes métalliques hante les cauchemars des adolescents dans la saga ""Les Griffes de la nuit"" ?",Freddy Krueger,Michael Myers,Jason Voorhees,Leatherface,2,Audiovisuel,-,,,,,,,
3TXN,,"Quel groupe a cédé à l'UNICEF les droits sur sa chanson ""Chiquitita"" ?",ABBA,Fleetwood Mac,Supertramp,The Carpenters,3,Musique,-,,,,,,,
NJ6O,,"Quelle maladie est ""aviaire"" quand elle est causée par le virus H5N1 ?",La grippe,La variole,La bronchite,Le choléra,1,Nature,grippe aviaire,,,,,,,
7FS0,736,Quelle cathédrale a donné son nom à un bleu révélé par la lumière qui traverse ses vitraux ?,La cathédrale de Chartres,La cathédrale de Reims,La cathédrale de Strasbourg,La cathédrale de Bourges,3,Arts,chartres | notre dame de chartres | cathedrale notre dame de chartres,,,,,,,
95GV,,Quel phénomène physique explique qu'un liquide chaud puisse parfois geler plus rapidement qu'un liquide froid ?,L'effet Mpemba,L'effet Seebeck,L'effet Tyndall,L'effet Peltier,4,Science,-,,,,,,,
3IMQ,,"Complétez ce vers d'un poème de Victor Hugo : ""L'œil était dans la tombe et regardait...""",Caïn,Moïse,David,Adam,3,Littérature,-,,,,,,,
F0NN,737,"À quel artiste doit-on la banane scotchée sur un mur, vendue 6,2 millions de dollars en 2024 ?",Maurizio Cattelan,Banksy,Joseph Kosuth,Damien Hirst,3,Arts,cattelan,,,,,,,
BY1F,,Quel est le nom du vêtement traditionnel utilisé dans la pratique du judo ?,Le judogi,Le hakama,Le tatami,Le katana,2,Sport,-,,,,,,,
XBIN,738,Quelle espèce de chien donne son nom à cette espèce de papillon ?,Le caniche,Le dalmatien,Le bouledogue,Le chihuahua,2,Nature,papillon caniche,,,,,,,
J2L7,,"Que signifie la lettre ""B"" dans le sigle ""FBI"" ?",Bureau,Brigade,Base,Border,2,Société,-,,,,,,,
0OTX,,Quel mot qualifie une pomme de terre récoltée environ 90 jours après sa plantation ?,Primeur,Nouvelle,Précoce,Fraîche,3,Gastronomie,-,,,,,,,
LIRA,,"En 1968, quel animal a été présenté comme candidat par un parti hippie à l'élection présidentielle américaine ?",Un cochon,Un âne,Une chèvre,Un singe,3,Société,porc | pigasus | pigasus the immortal,,,,,,,
0LAT,,Quel terme anatomique désigne la fosse localisée en arrière de l'articulation du genou ?,Le creux poplité,La fosse cubitale,Le triangle fémoral,La cavité infra-patellaire,3,Nature,fosse poplitée | poplitée,,,,,,,
SWQ7,739,"Quel est ce monument, classé au patrimoine mondial de l'UNESCO, qui domine l'entrée du port de Lisbonne ?",La tour de Belém,Le monastère des Hiéronymites,Le fort de São Julião da Barra,La tour de Tomar,3,Arts,-,,,,,,,
KIOQ,,Quel est le pays le plus peuplé d’Amérique du Sud ?,Le Brésil,L'Argentine,La Colombie,Le Pérou,1,Géographie,-,,,,,,,
VO1W,,De quelle ville Zohran Mamdani est-il élu maire en novembre 2025 ?,New York,Londres,Toronto,Madrid,2,Société,ny | new york city | nyc,,,,,,,
CLLX,,Quel homme politique américain est élu maire de la ville de New York en novembre 2025 ?,Zohran Mamdani,Jonathan Blake,Anthony Delgado,Samuel Wright,3,Société,mamdani,,,,,,,
12RJ,740,"Quelle est la signification du mot latin ""speculum"", d’où dérive le nom du biscuit ""speculoos"" ?",Miroir,Statue,Œil,Tableau,3,Littérature,-,,,,,,,
Q115,,"À quelle métropole américaine appartient Harlem, quartier emblématique de la Renaissance noire du XXe siècle ?",New York,Chicago,Detroit,Philadelphie,2,Géographie,ny | new york city | nyc,,,,,,,
8G3M,,"Quel légume peut être blanc, vert ou violet selon le moment de sa récolte ?",L'asperge,La courgette,L'aubergine,Le chou-fleur,2,Gastronomie,-,,,,,,,
E7HY,,Quel pays s’étend sur la façade occidentale de la péninsule Ibérique ?,Le Portugal,Le Maroc,Le Sénégal,La Grèce,1,Géographie,-,,,,,,,
9V0O,,Quelle ville accueille chaque année la cérémonie des Oscars ?,Los Angeles,New York,Las Vegas,Miami,2,Audiovisuel,-,,,,,,,
ZXOC,,Quel groupe de héros grecs accompagne Jason dans sa quête de la Toison d’or ?,Les Argonautes,Les Danaïdes,Les Myrmidons,Les Épigones,2,Croyances,-,,,,,,,
W7DB,,Quel maréchal de France est considéré comme le vainqueur de la bataille de la Marne ?,Joseph Joffre,Ferdinand Foch,Philippe Pétain,Louis Franchet d'Espèrey,3,Histoire,joffre | marechal joffre,,,,,,,
3GGS,,Dans quelle forteresse médiévale sont conservés les joyaux de la couronne britannique ?,La tour de Londres,Le château de Balmoral,Le palais de Kensington,La citadelle de Portsmouth,3,Histoire,tower of london,,,,,,,
6DBI,,Quel pays a été le premier au monde à légaliser le mariage entre personnes du même sexe en 2001 ?,Les Pays-Bas,Le Canada,La Norvège,L'Espagne,3,Société,hollande,,,,,,,
YT82,,"Quel joueur de tennis allemand était surnommé ""Boum-Boum"" en raison de la puissance de ses frappes ?",Boris Becker,Nicolas Kiefer,Tommy Haas,Michael Stich,3,Sport,becker,,,,,,,
0TTD,,Quel était le prénom du poète Mallarmé ?,Stéphane,Paul,Charles,Jules,2,Littérature,stephane mallarme,,,,,,,
QHV6,,Qui était le prédécesseur de Jacques Chirac à la mairie de Paris ?,Jules Ferry,André Malraux,Michel Debré,Jean Sylvain Bailly,3,Société,ferry,,,,,,,
3DMB,,Quelle est la couleur de la main utilisée comme symbole par SOS Racisme ?,Jaune,Rouge,Noire,Verte,2,Société,-,,,,,,,
YA9K,,À quel mouvement pictural associe-t-on Berthe Morisot ?,L'impressionisme,Le fauvisme,Le naturalisme,Le réalisme,2,Arts,-,,,,,,,
Y38E,,"Dans quelle ville fictive se déroule l'intrigue de la série ""Buffy contre les vampires"" ?",Sunnydale,Neptune,Smallville,Hill Valley,3,Audiovisuel,-,,,,,,,
JXIQ,,Quel adjectif qualifie ce qui est relatif à l'oncle ?,Avunculaire,Oncial,Patruelin,Adelphique,4,Littérature,-,,,,,,,
7OEV,,"À partir du lait de quel animal est confectionnée la ""mozzarella di bufala"" ?",La bufflone,La vache,La bisonne,La brebis,2,Gastronomie,bufflonne,,,,,,,
FGZN,,Quel type de ski est pratiqué lors d'un biathlon ?,Le ski de fond,Le ski alpin,Le ski de vitesse,Le ski acrobatique,2,Sport,fond,,,,,,,
KRZ8,741,Quel mammifère donne son nom à une espèce de scarabée munie d'une corne sur la tête ?,Le rhinocéros,Le bélier,Le taureau,Le cerf,1,Nature,-,,,,,,,
99Y8,742,Quel double féminin le peintre Marcel Duchamp s'était-il inventé ?,Rrose Sélavy,Laure Ebony,Suzzie Polidor,Athénaïs Ivory,3,Arts,-,,,,,,,
