type,img,question,A,B,C,D,difficulte,theme,fuzzy,exact,,,,,
S,,Sur quelle île britannique se déroule chaque année la course motocycliste du Tourist Trophy (TT) ?,L'île de Man,L'île de Wight,Jersey,Anglesey,3,Sport,man,,,,,,
S,,"Quel mollusque fossile, aujourd’hui disparu, est reconnaissable à sa coquille spiralée ?",L'ammonite,Le trilobite,L'orthocère,Le brachiopode,3,Sciences de la vie,ammonites | ammonoidea,,,,,,
S,245,"Quel est le surnom du plus grand fossible de Triceratops découvert, vendu aux enchères pour 6,6 millions d'euros en 2021 ?",Big John,Old Bones,Gentle George,Mighty Mary,4,Actualités & Médias,-,,,,,,
S,,"Quel est le nom de l'IA qui déclenche le Jugement dernier dans la saga ""Terminator"" ?",Skynet,Jarvis,Ultron,HAL 9000,3,Cinéma & Séries,-,,,,,,
S,246,Quel est le nom de ce dinosaure du Jurassique supérieur ?,Le brachiosaurus,Le stegosaurus,L'ankylosaurus,Le spinosaurus,3,Sciences de la vie,brachiosaure | brachiosaurus altithorax,,,,,,
S,247,Quel est le nom de ce dinosaure du Crétacé supérieur ?,L'ankylosaurus,L'iguanodon,Le stegosaurus,Le parasaurolophus,3,Sciences de la vie,ankylosaure | ankylosaurus magniventris,,,,,,
S,,Quel entraîneur de natation a accompagné Michael Phelps durant toute sa carrière olympique ?,Bob Bowman,Mark Spitz,Gregg Troy,Richard Quick,3,Sport,bowman | robert bowman,,,,,,
S,,Quel acronyme anglais de cinq lettres désigne le Président des États-Unis ?,POTUS,PREUS,USPRE,PRUSA,3,Économie & Politique,-,,,,,,
S,,"Quel titre de noblesse portait Pierre de Coubertin, fondateur des Jeux olympiques modernes ?",Baron,Comte,Duc,Marquis,3,Sport,-,,,,,,
S,,"Quel est le nom du monde parallèle dans lequel vivent les monstres de la série ""Stranger Things"" ?",Le Monde à l'Envers,Le Néant,La Vallée des Ombres,La Zone Fantôme,3,Cinéma & Séries,upside down,,,,,,
S,,Comment appelle-t-on les Français d’Algérie rapatriés en métropole après l’indépendance en 1962 ?,Les pieds-noirs,Les mains-noires,Les visages-noirs,Les cheveux-noirs,2,Histoire,pied noir,,,,,,
S,,"Quel animal est le personnage principal du film ""Babe"" (1995) ?",Un cochon,Une chèvre,Un canard,Un cheval,3,Cinéma & Séries,porc | porcelet,,,,,,
S,,"Quel homme politique français a fondé le ""Rassemblement du peuple français"" (RPF) en 1947 ?",Charles de Gaulle,André Malraux,Alain Poher,Michel Debré,3,Économie & Politique,de gaulle,,,,,,
S,,Combien de fleurs de lys figurent sur le drapeau du Québec ?,4,1,2,3,3,Géographie,quatre,1,,,,,
S,,Quel pont d'une longueur de 7845 mètres relie le Danemark à la Suède ?,Le pont de l’Øresund,Le pont de Storebælt,Le pont d’Älvsborg,Le pont de Sundsvall,4,Géographie,oresund,,,,,,
S,,Quel dieu de la mythologie égyptienne a été tué par Seth puis ressuscité par Isis ?,Osiris,Anubis,Horus,Thot,2,Croyances,-,,,,,,
S,,Quel serpent de la mythologie égyptienne personnifie le chaos et attaque chaque nuit la barque solaire de Rê ?,Apophis,Sobek,Sekhmet,Ptah,2,Croyances,apopis | apofis | apep | apepi | aapep | aapef,,,,,,
S,,Quel est le nom de l'océan primordial qui s'étend autour du monde selon la mythologie égyptienne ?,Le Noun,Le Geb,Le Khépri,Le Ptah,3,Croyances,nouou,,,,,,
S,,Quel symbole représente un serpent ou un dragon qui se mord la queue et incarne le renouveau éternel ?,L'ouroboros,L'ankh,Le triskel,La caducée,3,Croyances,-,,,,,,
S,,Quel jeu de cartes de casino consiste à obtenir une main d'une valeur la plus proche possible de 21 sans le dépasser ?,Le blackjack,Le baccarat,La roulette,Le poker,2,Jeux & BD,21 | vingt et un,,,,,,
S,,Quel phénomène astronomique se produit lors d'un alignement Terre-Lune-Soleil ?,Une éclipse solaire,Une éclipse lunaire,Un solstice,Un équinoxe,2,Sciences exactes,occultation solaire,,,,,,
S,248,Quel est le nom de ce phénomène astronomique ?,Une éclipse solaire,Un transit de Mercure,Une aurore boréale,Une éclipse lunaire,1,Sciences exactes,occultation solaire,,,,,,
S,,Quel dirigeant soviétique repose dans un mausolée situé sur la Place Rouge à Moscou ?,Vladimir Lénine,Joseph Staline,Mikhaïl Gorbatchev,Nikita Khrouchtchev,3,Histoire,lenine | vladimir ilitch lenine,,,,,,
S,,Dans quelle ville se situe la Place Rouge ?,Moscou,Varsovie,Pékin,Saint-Pétersbourg,2,Géographie,-,,,,,,
S,,Quel est le nom du navire océanographique utilisé par le commandant Jacques-Yves Cousteau ?,La Calypso,Le Nautilus,Le Beagle,La Victoria,3,Histoire,-,,,,,,
S,,Dans quelle ville se situe le parc Ueno ?,Tokyo,Pékin,Séoul,Hanoï,2,Géographie,-,,,,,,
S,,Quel mot japonais désigne les cerisiers en fleurs ?,Sakura,Hanami,Kiku,Ume,3,Sciences de la vie,-,,,,,,
S,,Quel est le terme médical pour la coloration bleue de la peau due à un manque d'oxygène dans le sang ?,La cyanose,Le purpura,L'ictère,L'érythème,3,Sciences de la vie,-,,,,,,
S,,"Chez certains invertébrés marins, quelle couleur prend le sang grâce à la présence d’hémocyanine ?",Bleu,Noir,Vert,Violet,2,Sciences de la vie,-,,,,,,
S,,Quel roman de science-fiction écrit par H.G. Wells en 1898 décrit une invasion martienne de la Terre ?,La Guerre des mondes,La Menace rouge,Terre en péril,L'Aube des envahisseurs,3,Littérature,the war of the worlds,,,,,,
S,,Quel film de science-fiction réalisé en 2015 par Ridley Scott raconte l'histoire d'un astronaute coincé sur Mars ?,Seul sur Mars,Interstellar,Gravity,Apollo 13,2,Cinéma & Séries,the martian,,,,,,
S,,"Sur quelle planète se trouve Olympus Mons, le plus haut volcan du système solaire ?",Mars,Venus,Mercure,Jupiter,2,Sciences exactes,-,,,,,,
S,,Quels sont les noms des deux satellites naturels de la planète Mars ?,Phobos et Deimos,Europa et Ganymede,Io et Callisto,Titan et Rhea,3,Sciences exactes,deimos phobos,,,,,,
S,,"Dans la mythologie nordique, quelle chèvre fournit l’hydromel aux guerriers du Valhalla ?",Heidrun,Arvakr,Hrimfaxi,Tanngrisnir,3,Croyances,-,,,,,,
S,,"Dans la mythologie nordique, qui désigne les héros dignes d’être accueillis au Valhalla ?",Les Valkyries,Les Nornes,Odin,Les Einherjar,2,Croyances,walkyries,,,,,,
S,,"Dans la mythologie nordique, quel dieu règne sur le Valhalla ?",Odin,Thor,Freyr,Loki,2,Croyances,-,,,,,,
S,,"Dans la mythologie nordique, combien de jambes possède Sleipnir, le cheval d'Odin ?",8,4,6,10,2,Croyances,huit,1,,,,,
S,,"Quel personnage se fait amputer d'une main dans la série télévisée ""Prison Break"" ?",T-Bag,John Abruzzi,Fernando Sucre,Michael Scofield,3,Cinéma & Séries,theodore bagwell | bagwell,,,,,,
S,,"Quel est le nom de la prison fictive dans laquelle se déroule la première saison de ""Prison Break"" ?",Fox River,Rikers Island,Sona,Pelican Bay,3,Cinéma & Séries,fox river state penitentiary,,,,,,
S,,"Quelle est la profession de Sara Tancredi dans la série télévisée ""Prison Break"" ?",Médecin,Avocate,Journaliste,Policière,3,Cinéma & Séries,-,,,,,,
S,,"Quel est le nom du personnage principal de la série télévisée ""Prison Break"" ?",Michael Scofield,Lincoln Burrows,John Abruzzi,Fernando Sucre,2,Cinéma & Séries,scofield,,,,,,
S,,"Quel est le nom du chien robotique qui accompagne le Docteur dans la série télévisée ""Docteur Who"" ?",K-9,B-12,M-1,D-8,3,Cinéma & Séries,-,,,,,,
S,,"Quelle est la planète d'origine du Docteur dans la série télévisée ""Docteur Who"" ?",Gallifrey,Skaro,Telos,Mondas,3,Cinéma & Séries,-,,,,,,
S,,"Quel personnage tombe amoureux de l'otage Mónica Gaztambide dans la série télévisée ""La Casa de Papel"" ?",Denver,Le Professeur,Berlin,Moscou,3,Cinéma & Séries,ricardo ramos | ramos,,,,,,
S,,"Quel personnage féminin est la narratrice de la série télévisée ""La Casa de Papel"" ?",Tokyo,Nairobi,Raquel,Mónica,3,Cinéma & Séries,silene oliveira | oliveira,,,,,,
S,,"Quel personnage est la narratrice de la série télévisée ""Desperate Housewives"" ?",Mary Alice Young,Lynette Scavo,Susan Mayer,Bree Van de Kamp,3,Cinéma & Séries,mary alice | young,,,,,,
S,,"Dans quelle rue fictive se déroule l'intrigue principale de la série télévisée ""Desperate Housewives"" ?",Wisteria Lane,Elm Drive,Oak Avenue,Maple Street,3,Cinéma & Séries,-,,,,,,
S,,"Quelle est la spécialité d'Amy Farrah Fowler dans la série télévisée ""The Big Bang Theory"" ?",La neurobiologie,L'astrophysique,Les mathématiques,L'informatique,4,Cinéma & Séries,neurosciences | biologie,,,,,,
S,,"Quel personnage travaille comme ingénieur au service de la NASA dans la série télévisée ""The Big Bang Theory"" ?",Howard Wolowitz,Rajesh Koothrappali,Leonard Hofstadter,Sheldon Cooper,3,Cinéma & Séries,howard | wolowitz,,,,,,
S,,"Quel est le prénom de la voisine de Sheldon et Leonard au début de la série télévisée ""The Big Bang Theory"" ?",Penny,Bernadette,Amy,Priya,3,Cinéma & Séries,-,,,,,,
S,,"Quel est le nom de cette créature, antagoniste principale de la première saison de ""Stranger Things"" ?",Le Démogorgon,L'Otyugh,Le Tarrasque,Le Balrog,2,Cinéma & Séries,-,,,,,,
S,,"Dans quelle sitcom américaine retrouve-t-on les personnages Joey, Ross, Rachel et Chandler ?",Friends,How I Met Your Mother,The Big Bang Theory,Scrubs,1,Cinéma & Séries,-,,,,,,
S,250,Quel est le nom de cette actrice américaine ?,Jennifer Aniston,Julia Roberts,Reese Witherspoon,Sandra Bullock,2,Cinéma & Séries,aniston,,,,,,
S,251,Quel est le nom de cet acteur britannique ?,Henry Cavill,Ben Aflleck,Liam Hemsworth,Matt Bomer,2,Cinéma & Séries,cavill,,,,,,
S,252,Quel est le nom de cet acteur américain ?,Johnny Depp,Orlando Bloom,Robert Downey Jr.,Colin Farrell,1,Cinéma & Séries,depp | john christopher depp II,,,,,,
S,253,Quel est le nom de ce couturier allemand ?,Karl Lagerfeld,Giorgio Armani,Jean-Paul Gaultier,Christian Dior,2,Arts & Culture,lagerfeld,,,,,,
S,254,Quel est le nom de cet homme politique sud-africain ?,Nelson Mandela,Martin Luther King Jr.,Kofi Annan,Cyril Ramaphosa,1,Économie & Politique,mandela,,,,,,
S,255,Quel est le nom de cet homme politique chinois ?,Mao Zedong,Xi Jinping,Kim Il-sung,Deng Xiaoping,2,Histoire,mao | zedong,,,,,,
S,256,Quel est le nom de cet homme politique allemand ?,Adolf Hitler,Heinrich Himmler,Joseph Goebbels,Hermann Göring,1,Histoire,hitler,,,,,,
S,257,Quel est le nom de cet homme politique français ?,Jacques Chirac,François Mitterrand,Valéry Giscard d'Estaing,Georges Pompidou,1,Économie & Politique,chirac,,,,,,
S,258,Quel est le nom de ce rappeur français ?,Orelsan,Nekfeu,Jul,Gringe,1,Musique,aurelien cotentin | cotentin,,,,,,
S,259,Quel est le nom de cette chanteuse française ?,Mylène Farmer,France Gall,Vanessa Paradis,Céline Dion,2,Musique,farmer | mylene gautier,,,,,,
S,260,Quel est le nom de cet acteur américain ?,Bryan Cranston,Kevin Spacey,Steve Carell,Matthew Perry,2,Cinéma & Séries,cranston,,,,,,
S,,Quel est le nom de la membrane qui enveloppe et protège le coeur chez l’être humain ?,Le péricarde,Le myocarde,La plèvre,Le médiastin,3,Sciences de la vie,-,,,,,,
S,,Quel est le nom de la membrane qui enveloppe les poumons et tapisse la cavité thoracique ?,La plèvre,Le péricarde,L'endothélium,Le diaphragme,3,Sciences de la vie,-,,,,,,
S,,"Quel acteur interprète le rôle du loup-garou dans le film ""Wolf"" (1994) ?",Jack Nicholson,Johnny Depp,Tom Cruise,Mel Gibson,3,Cinéma & Séries,nicholson,,,,,,
S,,Quel roi de la mythologie grecque est transformé en loup par Zeus après avoir essayé de le tromper ?,Lycaon,Orphée,Prométhée,Icare,3,Croyances,-,,,,,,
S,,Quel roi de la mythologie grecque a reçu le don de transformer tout ce qu'il touchait en or ?,Midas,Crésus,Minos,Lycaon,2,Croyances,-,,,,,,
S,,"Quel dieu de la mythologie grecque a accordé le ""don d'or"" au roi Midas ?",Dionysos,Zeus,Hermès,Apollon,3,Croyances,-,,,,,,
S,,Quelle est la commande Unix utilisée pour afficher le contenu d'un répertoire ?,ls,chmod,mv,cat,3,Technologie,-,,,,,,
S,,Quel est le langage de requête utilisé pour interroger et manipuler des bases de données relationnelles ?,SQL,HTML,JSON,JavaScript,3,Technologie,structured query language,,,,,,
S,,Quel est le langage de programmation principalement utilisé pour le développement d'applications iOS ?,Swift,C#,Python,Java,3,Technologie,-,,,,,,
S,,Quelle est la commande Unix utilisée pour changer les permissions d'un fichier ?,chmod,ls,rm,cp,3,Technologie,-,,,,,,
S,,Quelle constante fondamentale indique le nombre de particules contenues dans une mole ?,La constante d'Avogadro,La constante de Planck,La constante de Boltzmann,La constante de Faraday,2,Sciences exactes,avogadro | nombre d'avogadro,,,,,,
S,,Quelle constante physique relie la température d'un système à l'énergie moyenne d'agitation de ses particules ?,La constante de Boltzmann,La constante de Planck,La constante d'Avogadro,La constante de Loschmidt,3,Sciences exactes,boltzmann,,,,,,
S,,Quel est l'élément chimique le plus abondant dans l'univers ?,L'hydrogène,Le carbone,L'oxygène,L'hélium,1,Sciences exactes,h,,,,,,
S,,Quelle est la formule chimique du dioxyde de carbone ?,CO₂,CH₄,O₂,H₂O,1,Sciences exactes,CO2,1,,,,,
S,,Quelle est la formule chimique de l'eau ?,H₂O,CO₂,H₂O₂,O₂,1,Sciences exactes,H2O,1,,,,,
S,,Quelle est la formule chimique du sel de table ?,NaCl,NaOH,CaCl₂,NaNO₃,2,Sciences exactes,-,1,,,,,
S,,Quelle est la formule chimique du glucose ?,C₆H₁₂O₆,C₁₂H₂₂O₁₁,C₅H₁₀O₅,C₂H₅OH,4,Sciences exactes,C6H12O6,1,,,,,
S,,Quel est le sinus de 90° ?,1,0,-1,"0,5",2,Sciences exactes,un,1,,,,,
S,,Quel est le coefficient directeur de la droite d'équation y = 3x - 2 ?,3,0,1,2,2,Sciences exactes,trois,1,,,,,
S,,Quel est le quotient de 45 divisé par 9 ?,5,6,7,8,1,Sciences exactes,cinq,1,,,,,
S,,Quelle est la racine carrée de 144 ?,12,10,14,16,2,Sciences exactes,douze,1,,,,,
S,,Quelle est la valeur de π arrondie à deux décimales ?,"3,14","4,71","2,66","5,89",2,Sciences exactes,-,1,,,,,
S,,Quel est le PGCD (Plus Grand Commun Diviseur) de 18 et 24 ?,6,2,3,4,1,Sciences exactes,six,1,,,,,
S,,Quelle est la somme des angles intérieurs d'un triangle ?,180°,90°,360°,45°,2,Sciences exactes,180 | 180 degrés,1,,,,,
S,,"Si une voiture parcourt 180 km en 3 heures, quelle est sa vitesse moyenne en km/h ?",60 km/h,30 km/h,90 km/h,120 km/h,1,Sciences exactes,60 | soixante,1,,,,,
S,,Quelle est la valeur de l'angle dans un triangle équilatéral ?,60°,45°,90°,120°,2,Sciences exactes,60 | 60 degrés | soixante,1,,,,,
S,,Quel est le périmètre d'un carré dont le côté mesure 5 cm ?,20 cm,10 cm,15 cm,25 cm,1,Sciences exactes,"20 | vingt | 20 centimetres | 0,2 m | 200 mm",1,,,,,
S,,Quelle fleur est devenue un symbole de la révolution portugaise ?,L'oeillet,La pivoine,La rose,Le lys,3,Histoire,-,,,,,,
S,,Quel a été le dernier membre des Beatles à rejoindre le groupe ?,Ringo Starr,John Lennon,George Harrison,Paul McCartney,2,Musique,starr | richard starkey | starkey,,,,,,
S,,Quel fleuve est mentionné dans l'une des oeuvres du compositeur Johann Strauss II ?,Le Danube,La Volga,L'Amour,La Loire,3,Musique,-,,,,,,
S,,Dans quel pays le Danube prend-il sa source ?,L'Allemagne,L'Autriche,La Roumanie,La Hongrie,2,Géographie,-,,,,,,
S,,Quelle est la capitale de la Géorgie ?,Tbilissi,Bakou,Astana,Erevan,3,Géographie,-,,,,,,
S,261,Quel est le nom de cet artiste américain ?,Andy Warhol,Roy Lichtenstein,Keith Haring,Jackson Pollock,2,Arts & Culture,warhol | andrew warhola | warhola,,,,,,
S,,Quel physicien allemand a formulé le principe d’incertitude en mécanique quantique ?,Werner Heisenberg,Albert Einstein,Niels Bohr,Erwin Schrödinger,3,Sciences exactes,heisenberg,,,,,,
S,,"Quel artiste britannique interprète le rôle d'Andy Warhol dans le film ""Basquiat"" (1996) ?",David Bowie,Sting,Gary Oldman,Mick Jagger,4,Cinéma & Séries,bowie | david robert jones,,,,,,
S,262,Quel est le nom de ce musicien britannique ?,David Gilmour,Eric Clapton,Jimmy Page,Syd Barrett,2,Musique,gilmour,,,,,,
S,,"Quel surnom, issu de son clan xhosa, était utilisé pour désigner Nelson Mandela ?",Madiba,Rolihlahla,Baba,Nkosi,3,Économie & Politique,-,,,,,,
S,,Quel artiste américain a dessiné l'étiquette de vin du prestigieux Château Mouton Rothschild en 1975 ?,Andy Warhol,Marc Chagall,Keith Haring,Francis Bacon,4,Arts & Culture,warhol | andrew warhola | warhola,,,,,,
S,263,Quel est le nom de cet acteur américain ?,Denzel Washington,Idris Elba,Forest Whitaker,Samuel L. Jackson,2,Cinéma & Séries,washington,,,,,,
S,264,Quel est le nom de cet acteur américain ?,Tom Hanks,Robin Williams,Bill Murray,Kevin Costner,1,Cinéma & Séries,hanks,,,,,,
S,265,Quel est le nom de cet acteur américain ?,Robin Williams,Jim Carrey,Billy Crystal,Tom Hanks,2,Cinéma & Séries,williams,,,,,,
S,266,Quel est le nom de cet acteur néo-zélandais ?,Russell Crowe,Gerard Butler,Mel Gibson,Clive Owen,3,Cinéma & Séries,crowe,,,,,,
S,267,Quel est le nom de cet acteur britannique ?,Anthony Hopkins,Ian McKellen,Michael Caine,Sean Connery,2,Cinéma & Séries,hopkins,,,,,,
S,268,Quel est le nom de cet acteur américain ?,Marlon Brando,James Dean,Paul Newman,Al Pacino,2,Cinéma & Séries,brando | marlon brando jr,,,,,,
S,269,Quel est le nom de cet acteur australien ?,Heath Ledger,Christian Bale,River Phoenix,Colin Farrell,2,Cinéma & Séries,ledger,,,,,,
S,270,Quel est le nom de cet acteur britannique ?,Ben Kingsley,Naveen Andrews,Alec Guinness,Irrfan Khan,3,Cinéma & Séries,kingsley | krishna pandit bhanji,,,,,,
S,271,Quel est le nom de cet acteur américain ?,Will Smith,Chris Rock,Jamie Foxx,Eddie Murphy,1,Cinéma & Séries,smith,,,,,,
S,,"Quel économiste est l'auteur de ""La Richesse des nations"" (1776) ?",Adam Smith,Karl Marx,John Locke,Thomas Malthus,2,Économie & Politique,smith,,,,,,
S,,"Quel voile, couvrant les cheveux mais pas le visage, est porté par certaines femmes musulmanes ?",Le hijab,La burqa,Le niqab,L'abaya,2,Croyances,hidjab,,,,,,
S,,Quel est le nom de famille le plus courant en France ?,Martin,Durand,Richard,Petit,3,Divers,-,,,,,,
S,,Quel est le nom de famille le plus courant en Espagne ?,García,López,Fernández,Sánchez,3,Divers,-,,,,,,
S,,Quel est le nom de famille le plus courant en Italie ?,Rossi,Ferrari,Romano,Bianchi,3,Divers,-,,,,,,
S,,Quel est le nom de famille le plus courant en Allemagne ?,Müller,Weber,Wagner,Schmidt,3,Divers,-,,,,,,
S,,Quel est le nom de famille le plus courant au Royaume-Uni ?,Smith,Taylor,Jones,Williams,2,Divers,-,,,,,,
S,,Quel est le nom de famille le plus courant en Chine ?,Wang,Zhang,Li,Chen,3,Divers,-,,,,,,
S,,Quel est le nom de famille le plus courant en Russie ?,Ivanov,Petrov,Volkov,Popov,4,Divers,-,,,,,,
S,,Quel est le nom de famille le plus courant au Brésil ?,Silva,Santos,Oliveira,Pereira,3,Divers,-,,,,,,
S,,Quelle avenue emblématique de Barcelone relie la place de Catalogne au port ?,La Rambla,Le Paseo del Prado,La calle de Alcalá,La Via Laietana,3,Géographie,ramblas | rambles,,,,,,
S,,"Sur quel territoire national se situe Macao, ancienne colonie portugaise ?",La Chine,L'Indonésie,La Malaisie,La Thaïlande,3,Géographie,-,,,,,,
S,,Dans quel pays se situe le Grand désert de Victoria ?,L'Australie,Les États-Unis,Le Mexique,La Namibie,3,Géographie,commonwealth d'australie,,,,,,
S,,Quel monarque détient le record du plus long règne de l’Histoire ?,Louis XIV,Élisabeth II,Ramsès II,Pierre le Grand,2,Histoire,louis 14,1,,,,,
S,,Quel est le nom du premier homme à avoir marché sur la Lune ?,Neil Armstrong,Buzz Aldrin,Michael Collins,Alan Shepard,1,Histoire,armstrong,,,,,,
S,,Quel est le nom du seul tableau que Vincent van Gogh ait vendu de son vivant ?,La Vigne rouge,La Nuit étoilée,Les Iris,Les Mangeurs de pommes de terre,3,Arts & Culture,la vigne rouge a montmajour,,,,,,
S,,Quel organe du corps humain est principalement étudié en néphrologie ?,Les reins,Le foie,Les poumons,Le pancréas,3,Sciences de la vie,-,,,,,,
S,,"Quelle chanteuse française interprète ""Ma philosophie"" (2004) ?",Amel Bent,Diam's,Jenifer,Shy'm,2,Musique,bent,,,,,,
S,272,Quel est le nom de cette actrice australienne ?,Cate Blanchett,Toni Collette,Nicole Kidman,Naomi Watts,2,Cinéma & Séries,blanchett,,,,,,
S,273,Quel est le nom de cette actrice américaine ?,Julianne Moore,Marcia Cross,Jessica Chastain,Amy Adams,2,Cinéma & Séries,moore | julie anne smith,,,,,,
S,274,Quel est le nom de cette actrice britannique ?,Emily Blunt,Felicity Jones,Anne Hathaway,Lily James,3,Cinéma & Séries,blunt,,,,,,
S,275,Quel est le nom de cette actrice américaine ?,Jessica Chastain,Bryce Dallas Howard,Julianne Moore,Sophie Turner,3,Cinéma & Séries,chastain,,,,,,
S,276,Quel est le nom de cette actrice américaine ?,Sandra Bullock,Julia Roberts,Demi Moore,Cameron Diaz,3,Cinéma & Séries,bullock,,,,,,
S,277,Quel est le nom de cette actrice américaine ?,Sharon Stone,Kim Basinger,Michelle Pfeiffer,Demi Moore,2,Cinéma & Séries,stone,,,,,,
S,278,Quel est le nom de cette actrice américaine ?,Uma Thurman,Gwyneth Paltrow,Cameron Diaz,Daryl Hannah,2,Cinéma & Séries,thurman,,,,,,
S,279,Quel est le nom de cette actrice américaine ?,Angelina Jolie,Megan Fox,Jennifer Aniston,Catherine Zeta-Jones,1,Cinéma & Séries,jolie,,,,,,
S,280,Quel est le nom de cette actrice américaine ?,Emma Stone,Rachel McAdams,Kirsten Dunst,Amy Adams,3,Cinéma & Séries,stone,,,,,,
S,,Lors de quel Grand Prix de Formule 1 Pierre Gasly a-t-il remporté sa première victoire en 2020 ?,Grand Prix d’Italie,Grand Prix de France,Grand Prix de Belgique,Grand Prix de Monaco,3,Sport,italie | monza,,,,,,
S,,"Quel dessert à base de banane, glace et chantilly donne son titre à une chanson de Lio ?",Le banana split,Le banoffee pie,La banane flambée,Le pain aux bananes,2,Gastronomie,-,,,,,,
S,,"Quelle spécialiste japonaise en organisation est l'auteur de ""La Magie du rangement"" (2010) ?",Marie Kondō,Naomi Osaka,Sayaka Murata,Yoko Ono,3,Actualités & Médias,kondo,,,,,,
S,,"Qui est l'auteur du conte ""Le Vilain Petit Canard"" (1843) ?",Hans Christian Andersen,Charles Perrault,Les frères Grimm,Lewis Carroll,2,Littérature,andersen,,,,,,
S,,"Qui est l'auteur du conte ""La Petite Sirène"" (1837) ?",Hans Christian Andersen,J.M. Barrie,Charles Perrault,Oscar Wilde,2,Littérature,andersen,,,,,,
S,,"Qui est l'auteur du conte ""La Reine des neiges"" (1844) ?",Hans Christian Andersen,E.T.A. Hoffmann,Wilhelm Hauff,Les frères Grimm,2,Littérature,andersen,,,,,,
S,,"Qui est l'auteur du conte ""La Princesse au petit pois"" (1835) ?",Hans Christian Andersen,Oscar Wilde,Charles Perrault,Madame d'Aulnoy,3,Littérature,andersen,,,,,,
S,,"Qui est l'auteur du conte ""La Barbe bleue"" (1697) ?",Charles Perrault,Voltaire,Molière,Jean de La Fontaine,2,Littérature,perrault,,,,,,
S,,"Dans quel conte le personnage de soeur Anne ne voit que ""le soleil qui poudroie et l'herbe qui verdoie"" ?",La Barbe bleue,Peau d’Âne,Le Chat botté,Le Petit Chaperon rouge,3,Littérature,-,,,,,,
S,281,Quel est le nom de cette actrice suédoise ?,Alicia Vikander,Noomi Rapace,Rebecca Ferguson,Saoirse Ronan,3,Cinéma & Séries,vikander,,,,,,
S,282,Quel est le nom de cette actrice française ?,Eva Green,Charlotte Gainsbourg,Marion Cotillard,Rachel Weisz,3,Cinéma & Séries,green,,,,,,
S,283,Quel est le nom de cette actrice française ?,Léa Seydoux,Adèle Exarchopoulos,Virginie Efira,Charlotte Gainsbourg,3,Cinéma & Séries,seydoux,,,,,,
S,284,Quel est le nom de cette actrice américaine ?,Milla Jovovich,Kate Beckinsale,Angelina Jolie,Megan Fox,3,Cinéma & Séries,jovovich,,,,,,
S,285,Quel est le nom de cette actrice américaine ?,Faye Dunaway,Jane Fonda,Diane Keaton,Ali MacGraw,4,Cinéma & Séries,dunaway,,,,,,
S,286,Quel est le nom de cette actrice britannique ?,Rosamund Pike,Keira Knightley,Naomie Harris,Carey Mulligan,3,Cinéma & Séries,pike,,,,,,
S,287,Quel est le nom de cette actrice américaine ?,Anna Kendrick,Brie Larson,Zooey Deschanel,Hailee Steinfeld,3,Cinéma & Séries,kendrick,,,,,,
S,288,Quel est le nom de cette actrice américaine ?,Diane Keaton,Jane Fonda,Faye Dunaway,Meryl Streep,4,Cinéma & Séries,keaton | hall | diane hall ,,,,,,
S,289,Quel est le nom de cette actrice britannique ?,Felicity Jones,Keira Knightley,Daisy Ridley,Lily James,3,Cinéma & Séries,jones,,,,,,
S,290,Quel est le nom de cette actrice américaine ?,Grace Kelly,Audrey Hepburn,Elizabeth Taylor,Ingrid Bergman,3,Cinéma & Séries,kelly,,,,,,
S,291,Quel est le nom de cette actrice américaine ?,Carrie Fisher,Sigourney Weaver,Linda Hamilton,Daisy Ridley,3,Cinéma & Séries,fisher,,,,,,
S,292,Quel est le nom de cette actrice américaine ?,Kim Basinger,Sharon Stone,Michelle Pfeiffer,Daryl Hannah,3,Cinéma & Séries,basinger,,,,,,
S,293,Quel est le nom de cette actrice américaine ?,Blake Lively,Leighton Meester,Amber Heard,Kate Hudson,3,Cinéma & Séries,lively,,,,,,
S,294,Quel est le nom de cette actrice américaine ?,Michelle Pfeiffer,Kim Basinger,Kathleen Turner,Sharon Stone,3,Cinéma & Séries,pfeiffer,,,,,,
S,295,Quel est le nom de cette actrice canadienne ?,Katheryn Winnick,Emilia Clarke,Anna Torv,Charlize Theron,3,Cinéma & Séries,winnick | vinitska | katerena anna vinitska,,,,,,
S,296,Quel est le nom de cette actrice canadienne ?,Evangeline Lilly,Kate Beckinsale,Elizabeth Olsen,Liv Tyler,3,Cinéma & Séries,lilly,,,,,,
S,297,Quel est le nom de cette actrice américaine ?,Jennifer Love Hewitt,Alyssa Milano,Shannen Doherty,Jessica Alba,3,Cinéma & Séries,hewitt,,,,,,
S,,Quelle est la capitale de l'État américain du Colorado ?,Denver,Cheyenne,Aspen,Fort Collins,3,Géographie,-,,,,,,
S,,Quelle est la capitale de l'État américain du Tennessee ?,Nashville,Memphis,Jackson,Atlanta,3,Géographie,-,,,,,,
S,,Quelle est la capitale de l'État américain du Texas ?,Austin,Houston,Dallas,San Antonio,3,Géographie,-,,,,,,
S,,Quelle est la capitale de l'État américain de Louisiane ?,Bâton-Rouge,Monroe,Lafayette,Jackson,3,Géographie,-,,,,,,
S,,Quelle est la capitale de l'État américain de Hawaï ?,Honolulu,Maui,Hilo,Lahaina,3,Géographie,-,,,,,,
